franchise_href,franchise_name,description,franchise_category,franchise_type,costs,phone_number,email_address,year_established,company_name,company_address,country,currency,license_duration_in_years,net_profits_per_month,return_of_investments,royalty_fees_per_month
https://klikfranchisecom/services/franchisedankemitraan/detail/wpma4zekygkvrxyqzx2no3eloxaqg5bp0ovmd9wnw6rlbj1d81,Bandeng Segar Cabut Duri Minahasa,"Franchise yang fokus pada penyajian bandeng segar dengan duri yang sudah dicabut, mungkin dengan resep khas Minahasa.",Food & Beverage,Waralaba,15000000,,,,CV Tiara Raya,,,,,,,
https://klikfranchisecom/services/franchisedankemitraan/detail/wrjxm6zpjlw3wq2eab7y18dadg4p9nqdgmkyoonevrvbxg05lq,Bakmie Jawa,"Franchise mie yang mengusung cita rasa khas Jawa, mungkin dengan sajian tambahan khas Jawa.",Food & Beverage,Waralaba,45000000,,,,,,,,,,,
https://klikfranchisecom/services/franchisedankemitraan/detail/wwkyeqdg8dgjojwpk4xvreblnzlrnlx69mvb2azyz5man1730y,Avobi,Avobi adalah waralaba yang menyajikan menu makanan sehat dengan konsep salad bowl. Dengan pilihan bahan segar dan variasi saus yang lezat.,Food & Beverage,Waralaba,60000000,,,2020,,,,,,,,
https://klikfranchisecom/services/franchisedankemitraan/detail/wwodjoayypjvr6mklb8nbm47zlqgeqzl5ra3e9knwxzd0vp124,Apple Tree Preschool,Apple Tree Preschool adalah waralaba pendidikan anak usia dini. Menyediakan program pendidikan yang berfokus pada pengembangan anak secara holistik.,Education,Waralaba,2000000000,,,,Apple Tree Preschool,,,,,,,
https://klikfranchisecom/services/franchisedankemitraan/detail/wzomgbo3p4ljdqx0xenq8ay9adn2j6prvyl7ezdwbwk1a5krgg,Amigos,"Jasa restorant ala Meksiko yang menyediakan segala macam makanan, minuman",Food & Beverage,Waralaba,541952250,,,1979,PT Entertaint International,,,,,,,
https://klikfranchisecom/services/franchisedankemitraan/detail/x0lq2xpjqok5rddbggexa7ymqvz83zvlwvjpaynbekrw41nmoo,Apotek Century Pharma,"Apotik, toko obat/toko sediaansediaan farmasi dan alatalat kesehatan,",Health & Beauty,Waralaba,400000000,,,,PT Century Franchisindo Utama,,,,,,,
https://klikfranchisecom/services/franchisedankemitraan/detail/x9qgdd8vr2n13j4expok5wgmxlmw7xz0bpaaykello6mzrnjyv,Anin Rumah Batik,"Anin Rumah Batik adalah waralaba yang menawarkan produk batik dengan sentuhan modern. Dengan desain unik dan kualitas premium, waralaba ini membawa batik ke tingkat baru.",Fashion,Waralaba,20000000,,,,Anin Rumah Batik,,,,,,,
https://klikfranchisecom/services/franchisedankemitraan/detail/xa1bbkzl78gyordqdox923kp9djznywamvvxr5wmp4jeql06ey,Ayo Pintercom,"Sebuah bisnis dalam bidang teknologi komunikasi, mungkin terkait dengan perangkat atau layanan komunikasi pintar.",Technology,Waralaba,250000000,,,2010,CV Purwadira Multinasonal,,,,,,,
https://klikfranchisecom/services/franchisedankemitraan/detail/xblgkddbn20e1rp6oagao8jvgmwzey4jml5xwxrqkm39p7vny0,Arfa Babershop,Jasa potong rambut & perawatan rambut pria,Health & Beauty,Waralaba,50000000,,,,,,,,,,,
https://klikfranchisecom/services/franchisedankemitraan/detail/xeovkj5aj2zyawmne938qpkl8164dgdnlbxyrg0wb1m7zxrvqr,Ayam Geprek Mang Soetta,Ayam Geprek Mang Soetta adalah waralaba ayam geprek yang berlokasi di sekitar Bandara Soekarno-Hatta.,Food & Beverage,Waralaba,300000000,,,2017,,,,,,,,
https://klikfranchisecom/services/franchisedankemitraan/detail/xjpkx0v16elrpbyn5adn82qzb39mbwd4xkoogmq3ja7evyzwll,Bakmie Gila,"Mungkin menawarkan mie dengan rasa yang unik dan berbeda, menantang selera penggemar mie.",Food & Beverage,Waralaba,60000000,,,2006,CV Bagil sejahtera Makmur,,,,,,,
https://klikfranchisecom/services/franchisedankemitraan/detail/xp3yvn17xz2bawpkj9eveal6e16oldb5oq8m0rw4knxzmyrgjr,Ayam Bakar Pondok As Salam,Ayam Bakar Pondok As Salam adalah waralaba ayam bakar dengan konsep pondok yang nyaman dan suasana santai.,Food & Beverage,Waralaba,15000000,,,,CV Duta Mandiri Indonesia,,,,,,,
https://klikfranchisecom/services/franchisedankemitraan/detail/xvaywbrgkn8qopjbe9llzg45bxnprm7m3xqdxoa2ye60dkjw18,AM PM,"Distributor penjualan, toko retail jam",Hobby & Entertainment,Waralaba,560000000,,,1990,PT Sinar Sahabat,,,,,,,
https://klikfranchisecom/services/franchisedankemitraan/detail/xwwak8keeolnpvby5vng2grzpg7md3xb9xd41zojj6m0rqlypy,AYAM GUNTING CUWAN,AYAM GUNTING CUWAN adalah waralaba ayam gunting dengan cita rasa khas dan konsep yang menarik.,Food & Beverage,Waralaba,4999000,,,2020,Mitra Boga Jaya,,,,,,,
https://klikfranchisecom/services/franchisedankemitraan/detail/yd682lkvp341yge5kjblqa9amyaonrnpoeygzjxqd07mmwrvbd,Astra F&B,"Astra F&B adalah waralaba di bidang makanan dan minuman. Dengan konsep yang beragam, menawarkan pengalaman kuliner yang unik dan berkualitas.",Food & Beverage,Waralaba,8800000,,,2009,Astra F&B Corkorasi,,,,,,,
https://klikfranchisecom/services/franchisedankemitraan/detail/ym2xrpwk7bpnmjlzqdr5349njybokygqoayxelejav80wvz168,Bakso Buntut,Fokus pada penyajian bakso buntut yang mungkin menawarkan cita rasa lezat dan berbeda.,Food & Beverage,Waralaba,12000000,,,,CV HWK Media Utama,,,,,,,
https://klikfranchisecom/services/franchisedankemitraan/detail/yrgyevbo1jlmoe24ljgqkvp54k97r6knzqaanpbwdzmd3yx8wk,Bakmi Orange,Franchise mie dengan ciri khas mungkin pada penyajian atau rasa mie yang unik.,Food & Beverage,Waralaba,7500000,,,,Bakmi Orange,,,,,,,
https://klikfranchisecom/services/franchisedankemitraan/detail/yvl3epy40boqjmqwrnv759mzgbpnb6wlzax2eag8xdkko1grde,Bakmi Mada,Franchise mie yang menyajikan hidangan mie dengan berbagai pilihan topping dan kuah.,Food & Beverage,Waralaba,50000000,,,,PT Raos Aneka Pangan,,,,,,,
https://klikfranchisecom/services/franchisedankemitraan/detail/yvoqdzb2pg0rraygo6wdm4ezre5kw8elln1a3p9qmbk7nxjjy3,Bakmi Naga Resto,"Restoran, Restoran swalayan, Tempat makan yang menghidangkan kudapan",Food & Beverage,Waralaba,360000000,,,,PT Naga Jaya Sejahtera Indonesia,,,,,,,
https://klikfranchisecom/services/franchisedankemitraan/detail/yy1obxobkwpqp92r4vkzrnxnzxa0agmljw5qey6lm87gdjzvek,Baker's King,Franchise roti dan kue yang menawarkan berbagai produk bakery berkualitas tinggi.,Food & Beverage,Waralaba,1700000000,,,,,,,,,,,
https://klikfranchisecom/services/franchisedankemitraan/detail/yy2mjopqemwg3z6e8on7zxnlbmw5kbxagvbr1v9rdla0pkdyqb,Bakso Unyil,"Menyajikan bakso dengan ukuran yang kecil atau mini, mungkin dengan variasi rasa yang unik.",Food & Beverage,Waralaba,6000000,,,,CV Sukses Group,,,,,,,
https://klikfranchisecom/services/franchisedankemitraan/detail/z3ngy1rbjj5kvddbeoq74lgzv7mxeplz08ovmpwqr69nykw2aw,Anak Air,"Mengajarkan Keterampilan berenang secara menyenangkan, nyaman dan aman untuk Anak dan Dewasa",Education,Waralaba,550000000,,,,,,,,,,,
https://klikfranchisecom/services/franchisedankemitraan/detail/zl02vbxo58ez4rz9qkdnjnkm98wr7pdoewgyapjybg3m61laqj,Bakso Jejak Rasa,"Franchise bakso yang menawarkan variasi rasa yang berbeda-beda, mungkin dengan konsep jejak rasa yang unik.",Food & Beverage,Waralaba,15000000,,,2019,,,,,,,,
https://klikfranchisecom/services/franchisedankemitraan/detail/znpwyxrv3oqaek76x5dbe2lmeldgpjlmnojkywrazq81gvz4be,& Boba Bar,"Boba, Minuman berbahan dasar susu, Minuman berbahan dasar susu beraroma",Food & Beverage,Waralaba,40000000,,,2020,PT Fondasi Generasi Muda,,,,,,,
https://klikfranchisecom/services/franchisedankemitraan/detail/zny9y65dpprjdoqvz0x4emvx96a3e21bw8lkjlkgorbzqna7mo,Ayam Ngemper,"Ayam Ngemper menyajikan aneka menu mulai dari ayam goreng, lele goreng, tahu, tempe dan lainya plus aneka sambal",Food & Beverage,Waralaba,45000000,,,2019,,,,,,,,
https://klikfranchisecom/services/franchisedankemitraan/detail/zp5gzqybrg1rqwlowkl98vajbdomzxbxjn3ad4kd6nmev02pyl,Bebek BKB,Bebek goreng dengan keunikan cita rasa dan penyajian yang mungkin berasal dari BKB (Bebek Khas Bali).,Food & Beverage,Waralaba,1500000000,,,2017,PT NUANSA KULINARI INDONESIA,,,,,,,
https://klikfranchisecom/services/franchisedankemitraan/detail/zzey8mqon1znrw7k42kvlx3mgqqpyeaagbbvljgorwx9pd506a,Angkringan Pak Camat,Angkringan Pak Camat adalah waralaba angkringan dengan konsep tradisional. Menyajikan menu lezat dan suasana yang mengingatkan pada tradisi kuliner khas Indonesia.,Food & Beverage,Waralaba,15000000,,,2010,,,,,,,,
https://klikfranchisecom/services/franchisedankemitraan/detail/zzl0d2xzmgyneja173kqbowl5god9rpax6bverwpj8vkqy5g4l,Ayam GEPREK KISANAK,"Ayam geprek dan nasi kulit ayam ""Kisanak"" dengan rasa yang special dan sambal kemangi yang pedasnya bikin nagih",Food & Beverage,Waralaba,19000000,,,2019,CV Kisanak Global Food,,,,,,,
https://mitraloka.id/franchise/amenoramen/src=search,Ameno Ramen,"Kami Ameno Ramen merupakan sebuah usaha makanan Jepang/khusunya mie ramen di Kota Solo sejak Agustus 2017. Mie Ramen adalah jajanan khas yang menjamur di Negara Jepang yang memakan bahan baku utama yaitu mie dengan berbagai varian rasa, antara lain kuah tokyo ramen, curry ramen, yakisoba, miso ramen yang akan dibuat langsung dihadapan pembeli.",Food & Beverage,Peluang bisnis,15000000,,,2017,,,Indonesia,IDR,,,5 bulan,
https://mitraloka.id/franchise/ayamgorengbikintajir/src=search,Ayam Goreng Bikin Tajir,​​Ayam Goreng Bikin Tajir (AGBT) adalah produk ayam goreng krispi yang diracik dengan campuran tepung kaya akan rempah dan ayam berkualitas. AGBT yang disajikan secara fresh dan kriuk yang begitu menggoda membuat pengalaman menikmati ayam goreng krispi jadi berbeda dari biasanya.,Food & Beverage,Peluang bisnis,3200000,,,2020,"PT Tajir Kasih Berkat, Wahyoo Group",,Indonesia,IDR,,,2 bulan,
https://mitraloka.id/franchise/ayamsetan/src=search,Ayam Setan,"AyamSetan membuka outlet pertama nya pada bulan Januari 2018, di Jakarta Barat.",Food & Beverage,Peluang bisnis,18000000,,,2018,AyamSetan Indonesia,,Indonesia,IDR,,,2 bulan,
https://mitraloka.id/franchise/burgerbangor/src=search,Burger Bangor,"Burger Bangor merupakan sebuah gerai burger yang berdiri pada 8 Agustus 2019 di Jakarta Barat. Mengawali bisnis dengan gerai kecil, rupanya Burger Bangor mampu membuka 10 gerai yang tersebar di Jakarta dalam kurun waktu 6 bulan saja!",Food & Beverage,Waralaba,75000000,,,2019,PT Bangor Berkembang Bersama,,Indonesia,IDR,,,8 bulan,
https://mitraloka.id/franchise/chickenin/src=search,Chickenin,"Franchise kami bisa dibuka indoor / outdoor, dan memiliki prospek bisnis yang bagus sehingga dapat memberi passive income yang menarik. Kami memberi bukti, tidak hanya konsep bisnis. Selain itu, Chicke'Nin juga bebas royalty fee.",Food & Beverage,Peluang bisnis,9000000,,,2016,Chickenin Indonesia,,Indonesia,IDR,,,2 bulan,
https://mitraloka.id/franchise/dkriukfriedchicken/src=search,D' Kriuk Fried Chicken,DKriuk Fried Chicken adalah usaha mikro kecil menengah dengan sistem kemitraan yang dibangun sejak tahun 2020. Kami membangun usaha ini dengan sistem kemitraan. Kami menghadirkan berbagai menu yang inovatif serta paket kemitraan yang ekonomis.,Food & Beverage,Waralaba,17000000,,,2020,PT Raja Rasa Kuliner,,Indonesia,IDR,,,3 bulan,
https://mitraloka.id/franchise/esteh/src=search,Es Teh,"Es Teh Indonesia merupakan brand minuman berbahan dasar teh dengan konsep product 'Tea To Go'. Sebagai bentuk pemberdayaan terhadap petani teh, Es Teh Indonesia mengutamakan daun teh yang berasal dari petani lokal diberbagai daerah. Di Indonesia trend konsumsi meminum teh telah berakar pada budaya dan menjadi minuman yang paling banyak dikonsumsi nomor 2 di dunia setelah air putih. Es Teh Indonesia menyajikan berbagai varian olahan teh seperti es teh original, es teh melati, es teh leci, hingga es teh susu dengan tambahan topping cincau, krim keju, krim sea salt, dan puding susu.",Food & Beverage,Waralaba,95000000,,,2018,PT Esteh Indonesia Makmur,,Indonesia,IDR,,,12 bulan,
https://mitraloka.id/franchise/etejuicebar/src=search,Ete Juice Bar,"Sejak 2020, Ete Juice Bar hadir untuk memenuhi kebutuhan masyarakat akan minuman bernutrisi dan menyehatkan yang terbuat dari bahan bahan alami berkualitas tinggi.",Food & Beverage,Peluang bisnis,9000000,,,2022,Ete Juice Bar,,Indonesia,IDR,,,3 bulan,
https://mitraloka.id/franchise/flynnssandwichcult/src=search,Flynn's Sandwich Cult,Kami adalah perusahaan yang bergerak dalam bidang f&b dengan produk sandwich yang memiliki konsep yang colour full dan miliki gizi nilai gizi yang tinggi dari ingredient yang kami gunakan seperti protein dan serat.,Food & Beverage,Peluang bisnis,15000000,,,2021,Flynn's Sandwich Cult Indonesia,,Indonesia,IDR,,,4 bulan,
https://mitraloka.id/franchise/fremiltthaitea/src=search,Fremilt Thai Tea,"Kami adalah Brand Franchise Thai Tea di Indonesia. Outlet pertama kami berdiri sejak 2015 di Kota Solo,",Food & Beverage,Waralaba,9500000,,,2015,CV Antata,,Indonesia,IDR,,,2 bulan,
https://mitraloka.id/franchise/gendhisdawet/src=search,Gendhis Dawet,"Nostalgia sama minuman tradisional favorit keluarga kapan saja, dimana saja dengan Gendhis Dawet! Dawet yang kenyal, dipadukan dengan manisnya gula jawa dan gurihnya krimer nabati bikin Gendhis Dawet aman dikonsumsi siapa saja setiap hari. Sekarang jajan dawet nggak worry lagi kolesterol naik, karena Gendhis Dawet dibuat rendah gula, rendah lemak dan non kolesterol!",Food & Beverage,Peluang bisnis,3900000,,,2019,Gendhis Dawet Indonesia,,Indonesia,IDR,,,1 bulan,
https://mitraloka.id/franchise/inikopiulon/src=search,Ini Kopi Ulon,"Ini Kopi Ulon hadir dengan mengusung menumenu yang memiliki cita rasa Legit, Gurih, dan Creamy. Kami menggunakan bahan baku terbaik dengan produksi berstandar internasional sehingga menghasilkan rasa",Food & Beverage,Peluang bisnis,65000000,,,2019,Ini Kopi Ulon,,Indonesia,IDR,,,4 bulan,
https://mitraloka.id/franchise/jiwatoast/src=search,Jiwa Toast,"Jiwa Toast is a quickservice toast brand that perfectly complements the product offer of Janji Jiwa Coffee, now available from over 300 outlets nationwide.",Food & Beverage,Waralaba,85000000,,,2019,"PT Luna Boga Narayan, Jiwa Group",,Indonesia,IDR,,,8 bulan,
https://mitraloka.id/franchise/kamsiaboba/src=search,Kamsia Boba,"Berdasarkan hasil pencarian, ""Kamsia Boba"" adalah sebuah merek minuman boba lokal yang menawarkan berbagai varian minuman boba dengan harga yang ekonomis.",Food & Beverage,Waralaba,7400000,,,2019,PT Anak Kreasi Muda,,Indonesia,IDR,,,1 bulan,
https://mitraloka.id/franchise/kebabbabarafi/src=search,Kebab Baba Rafi,Kebab turki baba rafi adalah bisnis waralaba kebab terbesar di dunia,Food & Beverage,Waralaba,75000000,,,2006,"PT Baba Rafi Internasional, Baba Rafi Enterprise",,Indonesia,IDR,,,10 bulan,
https://mitraloka.id/franchise/kedaikopikulo/src=search,Kedai Kopi Kulo,Kedai Kopi Kulo merupakan perjalanan pertama dari KULO Group sampai akhirnya terciptalah beberapa brand makanan dan minuman lain di bawah naungan KULO Group. Kedai Kopi Kulo adalah titik perubahan dari “Coffeetogo” di dalam Market Indonesia.,Food & Beverage,Waralaba,135000000,,,2019,"PT Aneka Cipta Aplikasi, KULO Group",,Indonesia,IDR,,,8 bulan,
https://mitraloka.id/franchise/kopijanjijiwa/src=search,Kopi Janji Jiwa,"Janji Jiwa is a grabandgo coffee chain that adopts a freshtocup concept, serving a selection of classic Indonesian coffee products to our customers. Janji Jiwa has also managed to find a way to produce quality products at affordable prices by sourcing and roasting our local selection of Indonesian coffee. Our vision is to make Janji Jiwa a neighborhood grabandgo coffee chain, bringing Indonesian coffee culture to the world.",Food & Beverage,Waralaba,70000000,,,2018,PT Lunar Boga Narayan,,Indonesia,IDR,,,6 bulan,
https://mitraloka.id/franchise/kopisoe/src=search,Kopi Soe,"Kopi Soe adalah singkatan dari kopi susu dalam ejaan lama, kami menyajikan seduhan kopi yang dibuat dari biji kopi pilihan nusantara. Diolah dengan proses dan teknik modern untuk menghasilkan segelas kopi dengan rasa lokal, ketika rasa nikmat kopi, susu yang creamy, menyatu dengan aroma wangi dari gula aren. Saat ini kopi adalah bagian dari lifestyle dan menjadi kebutuhan untuk setiap orang dari berbagai kalangan",Food & Beverage,Waralaba,75000000,,,2018,PT. Eos Maju Bersama,,Indonesia,IDR,,,23 bulan,
https://mitraloka.id/franchise/kopiyor/src=search,Kopi Yor,"Kopi Yor merupakan brand lokal es Kopi susu kekinian yang memiliki keunikan tersendiri dari rasa dan desainnya. Kopi Yor sendiri memiliki menu yang menjadi pelopor perpaduan antara Kopi dan Kelapa Kopyor. Sesuai dengan nama brand, varian Es Kopi Yor yang merupakan perpaduan antara rasa pahit kopi dan rasa khas kelapa kopyor. Nama Kopi Yor sendiri terinspirasi dari outlet pertama Kopi Yor yang berada di Jalan Kelapa Kopyor, Kelapa Gading, Jakarta Utara.",Food & Beverage,Peluang bisnis,70000000,,,2018,"PT Otewe Maju Bersama, OMB Group",,Indonesia,IDR,,,9 bulan,
https://mitraloka.id/franchise/lionparcel/src=search,Lion Parcel,"Lion Parcel merupakan perusahaan penyedia jasa kuris, jasa pengiriman domestik dan internasional. Lion Parcel didukung oleh jaringan dan infrastruktur Lion Group.",Logistics,Keagenan,5000000,,,2013,,,Indonesia,IDR,,,2 bulan,
https://mitraloka.id/franchise/manjacheesetea/src=search,Manja Cheese Tea,"Bubble Tea mengawali trend minuman populer dengan konsep teh olahan yang dipadukan dengan bubble topping pada tahun 2021, menginjak pertumbuhan bisnis di tahun 2014 kembali membawa trend minuman milk tea populer, kemudian pada tahun 2017 sangat populer dengan trend teh olahan terbaru. minuman dari Thailand yang sangat kita kenal sebagai Thai Tea.",Food & Beverage,Peluang bisnis,5800000,,,2019,"PT Anak Kreasi Muda, Anak Kreasi Muda Group",,Indonesia,IDR,,,3 bulan,
https://mitraloka.id/franchise/menantea/src=search,Menantea,"Menantea merupakan minuman teh fusion yang dikemas secara kekinian dengan harga yang terjangkau. Di kalangan anak muda Indonesia telah terjadi peningkatan gaya hidup yang cukup signifikan di tahun 2020 sampai 2021, kebutuhan alternatif minuman yang enak, sehat, menyegarkan dengan cita rasa yang yang sesuai dengan lidah masyarakat Indonesia semakin meningkat. Menantea menghadirkan berbagai varian menu olahan teh fusion dengan nama yang unik dan menjadi menu signature seperti InTEAgral perpaduan antara royal honey milk tea boba, MatemaTEAka perpaduan antara green tea dan buahbuahan segar, dan Mantappu Tea perpaduan antara teh asli khas Indonesia dipadukan dengan buah leci dan cheese cloud.",Food & Beverage,Waralaba,125000000,,,2020,Jerome Polin Sijabat,,Indonesia,IDR,,,11 bulan,
https://mitraloka.id/franchise/ngikan/src=search,Ngikan,"Bisnis kemitraan atau franchise yang menawarkan peluang usaha kuliner dengan bahan utama ayam goreng tentu sudah sangat banyak di Indonesia. Apalagi sebagian besar masyarakat sangat menggemari makanan dengan berbagai olahan ayam. Namun, bisnis franchise yang mengusung bahan utama dari ikan tampaknya belum banyak dijumpai di Indonesia.",Food & Beverage,Peluang bisnis,300000000,,,2019,"PT Baba Rafi Internasional, Baba Rafi Enterprise",,Indonesia,IDR,,,12 bulan,
https://mitraloka.id/franchise/rachachathaitea/src=search,Rachacha Thai Tea,"Racacha Thai Tea Indonesia merupakan salah satu usaha yang bergerak dibidang kuliner minuman cepat saji, Racacha berusaha untuk menjadi bisnis waralaba thai tea terbesar, menguntungkan, dan paling dipercaya oleh para mitra. Racacha menawarkan minuman yang enak dan segar dengan bahan baku berkualitas tinggi namun dengan harga yang terjangkau serta memberikan pelayanan yang memuaskan untuk para mitra dan pelanggan Racacha thai tea Indonesia.",Food & Beverage,Waralaba,8200000,,,2016,Rachacha Thai Tea Indonesia,,Indonesia,IDR,,,2 bulan,
https://mitraloka.id/franchise/sabanafriedchicken/src=search,Sabana Fried Chicken,"Berawal dari kekhawatiran akan produk ayam yang beredar di pasaran, yaitu produk ayam yang belum jelas secara penyembelihan dan kualitasnya. Maka pada 6 Agustus 2006, H. Syamsalis membuka booth atau gerobak pertama Sabana Fried Chicken yang berlokasi di Komplek Duta Indah Kota Bekasi. Sabana Fried Chicken hadir untuk memenuhi kebutuhan masyarakat Indonesia dengan produk Fried Chicken yang halal, nikmat, dan bergizi",Food & Beverage,Waralaba,22000000,,,2006,PT Sumber Berkah Negeri,,Indonesia,IDR,,,5 bulan,
https://mitraloka.id/franchise/tahugo/src=search,Tahu Go,"Tahu adalah termasuk makanan favorite masyarakat Indonesia dari berbagai kalangan. Bisnis Tahu Goreng Kriuk adalah bisnis jangka panjang. Coba perhatikan gerobak gorengan dimana saat anda SD doyan jajan gorengan , dan sampai sekarang gerobak gorengan itu masih ada dan sudah berganti generasi, biasanya sudah dipegang anaknya. Ini bukti nyata bahwa tahu gorengan sangat diminati , dan orang terus repeat order. Karena itu jika anda membuka TAHU GO adalah keputusan terbaik karena selain murah repeat ordernya juga bagus",Food & Beverage,Peluang bisnis,19500000,,,2019,"PT Otewe Maju Bersama, OMB Group",,Indonesia,IDR,,,5 bulan,
https://mitraloka.id/franchise/tahukriukyes/src=search,Tahu Kriuk Yes,Sudah menjadi budaya orang Indonesia untuk mengkonsumsi gorengan terutama tahu.,Food & Beverage,Peluang bisnis,15000000,,,2018,Tahu Kriuk YES,,Indonesia,IDR,,,2 bulan,
https://mitraloka.id/franchise/titikoma/src=search,Titikoma,Berbeda dengan kebanyak franchise yang mengedepankan outlet berbentuk booth untuk penjualan takeandgo; Titik Koma Kopi menghadirkan konsep coffee shop sebagai cafe tempat nongkrong lengkap dengan area duduk.,Food & Beverage,Waralaba,130000000,,,2016,PT Titikoma Bahagia Abadi,,Indonesia,IDR,,,9 bulan,
https://mitraloka.id/franchise/xinonaboba/src=search,XI NO NA Boba,"XI NO NA Boba merupakan produk minuman Boba kekinian dengan varian lengkap dengan konsep yang elegan dan tentunya sangat terjangkau untuk semua kalangan. Konsep minuman cepat saji dengan kualitas tinggi, dikemas secara menarik dengan cup printing, outlet minimalis dan berkarakter.",Food & Beverage,Waralaba,6000000,,,2019,PT Bersatu Cipta Sukses,,Indonesia,IDR,,,2 bulan,
https://pilar.asia/product/8spicesnasibakarayampenyet,8Spices Nasi Bakar & Ayam Penyet,8 SPICES ( Nasi Bakar & Ayam Penyet ) menyajikan Nasi Bakar dan Ayam Penyet.,Food & Beverage,Waralaba,70000000,,,,,Lokasi Kami,,,36,56750000,,0
https://pilar.asia/product/aayampenyetsambaljandangamuk,Aayam Penyet Sambal Janda Ngamuk,Berawal dari sebuah ide untuk kuliner unik dengan cita rasa Nusantara. Ayam penyet merupakan makanan yang tidak pernah membosankan dan selalu menjadi pilihan hidangan saat makan.,Food & Beverage,Kemitraan,60000000,,,,,,,,36,47959900000,,0
https://pilar.asia/product/aigemifranchiseayamcrispyricebox,Ai Gemi  Ayam Crispy & Rice Box,"Bermula dari tiga orang pendiri yang hobi kuliner dan suka mencoba makananmakanan baru, namun terkendala adanya pandemi di pertengahan tahun 2020",Food & Beverage,Waralaba,15000000,,,,,📍Jakarta 📍Depok 📍Bekasi,,,0,1750000,,0
https://pilar.asia/product/aladdinkebab,Aladdin Kebab,Aladdin Kebab adalah Bisnis Waralaba Kebab dalam naungan PT. SAJIAN KAWULA MUDA yang dapat menjangkau ke seluruh Indonesia dengan bisnis yang menguntungkan.,Food & Beverage,Waralaba,34000000,,,,,,,,0,4143200,,0
https://pilar.asia/product/allclean,All Clean,"Berawal dari memulai usaha laundry sendiri di bilangan Bintaro dan memiliki beberapa cabang yang berjalan seiring berjalannya waktu hingga mulai membantu para pengusaha lain yang ingin memulai usaha laundry kami menyediakan segala macam solusi laundry dari mulai pengadaan mesin , desain , pengerjaan instalasi pembukaan outlet laundry , penyediaan bahan baku produksi seperti deterjen dan parfum laundry serta sistem teknologi pendukung jasa laundry hingga jasa konsultasi manajemen pengelolaan bisnis laundry itu sendiri hingga saat ini kami telah membuka ratusan outlet yang tersebar di Indonesia",Cleaning Services,Kemitraan,100000000,,,,,,,,0,0,,0
https://pilar.asia/product/aloefreshfranchiseminumanaloevera,Aloe Fresh  Minuman Aloe Vera,Aloe Vera banyak digunakan selama berabadabad. Kurang lebih 400 tahun yang lalu sampai sekarang Aloe Vera sangat dikenal khasiatnya karena pada pelepahnya terdapat berbagai macam kandungan nutrisi.,Food & Beverage,Waralaba,9900000,,,,,"📍 Green Lake, Pluit, Pesanggrahan, Tanjung Duren",,,36,3475000,,0
https://pilar.asia/product/alpokatgoyang,Alpokat Goyang,Alpokat Goyang adalah waralaba yang menghadirkan varian minuman segar berbasis alpukat dengan sentuhan inovatif. Waralaba ini menawarkan pengalaman unik dalam menikmati alpukat dengan variasi rasa yang menarik.,Food & Beverage,Kemitraan,7800000,,,,,,,,0,7080000,,0
https://pilar.asia/product/amenoramen,Ameno Ramen,"Cita cita kami selalu ingin membawa peluang makanan mahal di resto untuk dibuat terjangkau dan kita bawa di street food Karna juga pada asalnya ramen berasal dari kota Fukuoka di Jepang yang memakai konsep sering disebut yatai (Angkrinagn) sehingga Ramen merupakan makanan yang seharusnya dapat dinikmati oleh berbagai macam orang dari berbagai macam kelas, bukan hanya orang orang kelas menengah atas yang dapat menikmati cita rasa asli dari Jepang ini Di Ameno Ramen, saya membuat Ramen yg terlihat rumit di Ameno kita buat sesederhana mungkin dengan cita rasa asli dan karakter orisinil asalnya.",Food & Beverage,Waralaba,15000000,,,,,,,,12,3880000,,0
https://pilar.asia/product/autocleanwaterless,AutoClean Waterless,"AutoClean Waterless berdiri sejak 13 Februari 2016 dimulai dengan memiliki 2 tempat di Bogor dan Kalimalang dan hingga akhirnya memiliki 99 cabang yang tersebar di seluruh wilayah Indonesia. AutoClean Waterless merupakan Jasa Cuci dan Perawatan kendaraan yang hemat air. Sistem pembersihan menggunakan cara yang berbeda daru cara cuci kendaraan biasanya, Yakni dengan sistem ""Waterless"". Cairannya terbuat dari Carnauba Wax, Sealant dan Carbon, membuat Kendaraan lebih terlihat bersih dan juga terlindungi dari UV, hawa dingin dan Panas.",Cleaning Services,Kemitraan,89000000,,,,,"Kelurahan Jl. Durian Raya No.1, RT.01/RW.05, Baranangsiang, Bogor Timur, Bogor City",,,0,18750000,,0
