,franchise_href,franchise_name,description,franchise_category,franchise_type,costs,phone_number,email_address,year_established,company_name,company_address,country,currency,license_duration_in_years,net_profits_per_month,return_of_investments,royalty_fees_per_month,labels,,19,Education,Transportation,Automotive,Cleaning Services,Tour & Travel,Food & Beverage,Jasa Logistics,Hobby & Entertainment,Logistics,Beauty & Healthy,Teknologi,Cleaninf Servces,Retail & Minimarket,Advertising,Fashion,Finance,Food & Beverage Shop,Health & Beauty,Technology
452,https://klikfranchise.com/services/franchisedankemitraan/detail/v8dv36ylqenokwan7ema5wm9e21vxpgkzjxgdorlbp2qbzyrjd,Serious Cut Barbershop,Layanan potong rambut dan perawatan rambut untuk pria dengan konsep yang serius dan profesional.,Health & Beauty,Waralaba,60000000.0,0821 2626 5697,,2014.0,Serious Group.,,,,,,,,445,0,0,0,0,0,0,0,0,0,0,0,0,0,0,0,0,0,0,0,1,0
453,https://klikfranchise.com/services/franchisedankemitraan/detail/v9b4j0lo5n1grddmjxxq368ryerqap2wzboeepvzgykavy7mng,Tous Les Jours,French-Asian bakery yang menawarkan berbagai produk roti dan kue dengan konsep dan rasa yang unik.,Food & Beverage,Waralaba,420000000.0,021 5080 5123,touslesjoursid@cj.co.id,1997.0,CJ FOODVILLE BAKERY AND CAFE INDONESIA.,,,,,,,,275,0,0,0,0,0,0,0,1,0,0,0,0,0,0,0,0,0,0,0,0,0
454,https://klikfranchise.com/services/franchisedankemitraan/detail/vad8w7nm0onxvbzkzepyrqyxeg4qg9d36jb5gelpka1jmv2rlp,Tentang Kita,"Tempat makan atau bisnis kuliner dengan konsep ""tentang kita"".",Food & Beverage,Waralaba,3800000.0,085 942 166 963,Cokelattentangkita@gmail.com,2020.0,,,,,,,,,703,0,0,0,0,0,0,0,1,0,0,0,0,0,0,0,0,0,0,0,0,0
455,https://klikfranchise.com/services/franchisedankemitraan/detail/vaj54kpl6qmv9b7rqlk3drezqpwv2dpxx0ygowbo1nmj8eayg1,Uncledazs Popcron Chicken,Bisnis yang menawarkan ayam popcorn dengan cita rasa yang khas dan beragam.,Food & Beverage,Waralaba,15000000.0,0857 1066 2299,,2015.0,Barley Bread Indonesia.,,,,,,,,137,0,0,0,0,0,0,0,1,0,0,0,0,0,0,0,0,0,0,0,0,0
456,https://klikfranchise.com/services/franchisedankemitraan/detail/vamdx0vblzzqrlb3xm9q7g5er5wyonkynea24wp1jg6kprj8dg,Suga Food Fried Chicken,Warung makan yang menawarkan berbagai hidangan ayam goreng dengan rasa yang unik.,Food & Beverage,Waralaba,20000000.0,021 8499 0220,,,Suga Food Indonesia.,,,,,,,,912,0,0,0,0,0,0,0,1,0,0,0,0,0,0,0,0,0,0,0,0,0
457,https://klikfranchise.com/services/franchisedankemitraan/detail/vdwyjyqb9gndp2rxx3l7az8madqvkmjpkewel0oa4n5g1bvo6e,Takoyaki Mr Han Sambas,Tempat yang menyajikan takoyaki dengan sentuhan khas atau pemiliknya.,Food & Beverage,Waralaba,8000000.0,0821 5863 2212,takoyakisambas@gmail.com,2013.0,,,,,,,,,791,0,0,0,0,0,0,0,1,0,0,0,0,0,0,0,0,0,0,0,0,0
458,https://klikfranchise.com/services/franchisedankemitraan/detail/veyw756v4nag0wyazk2ez8mj1joqqpdmr1ljobvdlxpbr3nxgy,Sourtie's,Warung makan dengan konsep atau menu yang mungkin menonjolkan cita rasa asam atau sour.,Food & Beverage,Waralaba,150000000.0,021 6385 4252,mushroomfamilyresto@gmail.com,2014.0,PT. Aritama Mandiri.,,,,,,,,903,0,0,0,0,0,0,0,1,0,0,0,0,0,0,0,0,0,0,0,0,0
459,https://klikfranchise.com/services/franchisedankemitraan/detail/vkzoo61lyd0rqeglxv2b3ydbb8kvwjnzappwe8qxm9g4rm5ajo,Tahu Go!,Tempat makan atau gerai makanan yang menawarkan berbagai hidangan tahu.,Food & Beverage,Waralaba,18500000.0,0812 9030 2236,,2019.0,PT OTEWE MAJU BERSAMA.,,,,,,,,708,0,0,0,0,0,0,0,1,0,0,0,0,0,0,0,0,0,0,0,0,0
460,https://klikfranchise.com/services/franchisedankemitraan/detail/vlgb1dp4vd6x3kreb92nwoy0awgovj7j8rq5nqmmpayzkaewlw,Waroeng Western,"Warung makan dengan konsep masakan Barat atau Western, menawarkan berbagai hidangan Barat yang lezat.",Food & Beverage,Waralaba,99700000.0,0899 7075 899,andy@waroengwestern.com,2013.0,,,,,,,,,906,0,0,0,0,0,0,0,1,0,0,0,0,0,0,0,0,0,0,0,0,0
461,https://klikfranchise.com/services/franchisedankemitraan/detail/vlqy9ga38rlbzazvye1d7domz0e0pxw5k6qj4vpxrkbongwmnr,Taw Taw Tahu,Tempat yang menyajikan tahu dengan sentuhan yang unik atau berbeda.,Food & Beverage,Waralaba,4300000.0,0857 4984 9678,cs.tawtawtahu@gmail.com,2019.0,,,,,,,,,782,0,0,0,0,0,0,0,1,0,0,0,0,0,0,0,0,0,0,0,0,0
462,https://klikfranchise.com/services/franchisedankemitraan/detail/vlx2z4epyjnkma0j3o8k7odgrdanq5gbvyzbdxw16rrlw9epmp,Wahana Logistik,Bisnis logistik atau pengiriman barang dengan fokus pada layanan yang andal dan efisien.,Jasa Logistics,Kemitraan,3000000.0,0812 6578 9999,,,PT. Wahana Prestasi Logistik.,,,,,,,,133,0,0,0,0,0,0,0,0,1,0,0,0,0,0,0,0,0,0,0,0,0
463,https://klikfranchise.com/services/franchisedankemitraan/detail/vmokn9x1playkde07qzw63azgkzgogyw8nexl2rjvbjrd4mpv9,Tea and You,Kafe atau gerai minuman yang menawarkan berbagai jenis teh.,Food & Beverage,Waralaba,12000000.0,0813 2626 2815,teaandyou.id@gmail.com,2018.0,Astamada Indonesia.,,,,,,,,373,0,0,0,0,0,0,0,1,0,0,0,0,0,0,0,0,0,0,0,0,0
464,https://klikfranchise.com/services/franchisedankemitraan/detail/vmyjb3pxpxwelmrz5gyjnkvbzarvdq61l4eg2qo8o7nak90add,Twistelor,Warung makan yang mungkin menawarkan berbagai jenis twisted bread atau roti yang unik dan lezat.,Food & Beverage,Waralaba,10000000.0,0877 7333 3579,mouthfulindonesia@gmail.com,2017.0,,,,,,,,,951,0,0,0,0,0,0,0,1,0,0,0,0,0,0,0,0,0,0,0,0,0
465,https://klikfranchise.com/services/franchisedankemitraan/detail/vnq3d1dpbyzavx798wo2xlryv465ag4ejpgewzmokn0jmkbvlm,Soto Ayam Kampung Surabaya ’Jolali’,Warung makan yang menyajikan soto ayam dengan cita rasa kampung Surabaya.,Food & Beverage,Waralaba,20000000.0,021 9384 6527,,,Soto Ayam Kampung Surabaya ’Jolali’.,,,,,,,,950,0,0,0,0,0,0,0,1,0,0,0,0,0,0,0,0,0,0,0,0,0
466,https://klikfranchise.com/services/franchisedankemitraan/detail/vp1bea2ykawgzk9z6jlomom84qrvy30qxql7nbxvd4jnpwdr59,Xcelcius Coffee,"Menawarkan kopi dengan variasi rasa dan metode penyajian yang berbeda, menciptakan suasana kafe yang nyaman dan modern.",Food & Beverage,Waralaba,70000000.0,0877 4882 4888,,2016.0,Xcelcius Coffee.,,,,,,,,490,0,0,0,0,0,0,0,1,0,0,0,0,0,0,0,0,0,0,0,0,0
467,https://klikfranchise.com/services/franchisedankemitraan/detail/vpp74gnk5bmxzllx869gea01g4njrm2jryodwwe3yqbaokvzd2,Ulir Kriuk Kentang Crispy Spiral,Bisnis yang menawarkan kentang kriuk dengan konsep spiral atau berbentuk ulir.,Food & Beverage,Waralaba,10000000.0,021 7050 6226,,,Ulir Kriuk Kentang Crispy Spiral.,,,,,,,,141,0,0,0,0,0,0,0,1,0,0,0,0,0,0,0,0,0,0,0,0,0
468,https://klikfranchise.com/services/franchisedankemitraan/detail/vq6v8d4aj2rlere1obymxonmxkzbv9g5lxwpw7djnkykp3a0ga,Snackmakaroni,Bisnis yang menawarkan macaroni atau camilan dengan konsep yang menarik.,Food & Beverage,Waralaba,4000000.0,,snackmakaroni@gmail.com,2018.0,,,,,,,,,142,0,0,0,0,0,0,0,1,0,0,0,0,0,0,0,0,0,0,0,0,0
469,https://klikfranchise.com/services/franchisedankemitraan/detail/vqoznzpx4d0m19w7ergwb8dqrepv2y5ala3jvlygkr6bokjxe3,Tahu Kriuk Yumz,Tempat yang menyajikan tahu kriuk dengan variasi rasa yang lezat (Yumz).,Food & Beverage,Waralaba,12000000.0,0812 9186 9032,tahukriukyumz@gmail.com,2020.0,Tahu Yumz.,,,,,,,,790,0,0,0,0,0,0,0,1,0,0,0,0,0,0,0,0,0,0,0,0,0
470,https://klikfranchise.com/services/franchisedankemitraan/detail/vv0vpwablb89o7ozqnn3gemj8wralpygq2kxmwedr1j5dxk6y2,Super Buble,Gerai minuman yang menawarkan minuman bergelembung dengan variasi rasa.,Food & Beverage,Waralaba,2900000.0,021 3375 0861,,,Super Buble.,,,,,,,,308,0,0,0,0,0,0,0,1,0,0,0,0,0,0,0,0,0,0,0,0,0
471,https://klikfranchise.com/services/franchisedankemitraan/detail/vvmxzwlj14wzoebddgpa57o87o86krqqevjykg0an3m9pnrlbp,Takeshi Bento,Tempat yang menyajikan bento dengan nama yang mencerminkan gaya Takeshi.,Food & Beverage,Waralaba,3000000.0,021 7082 6000,,,PT Trivatindo Pratama.,,,,,,,,756,0,0,0,0,0,0,0,1,0,0,0,0,0,0,0,0,0,0,0,0,0
472,https://klikfranchise.com/services/franchisedankemitraan/detail/vw2zrm9vkyddepxzpq1oxwrmyqm4kl8qlnj0bo3e57jagvbngd,SEREM,Warung makan yang mungkin menawarkan hidangan dengan rasa yang serem atau menegangkan.,Food & Beverage,Waralaba,15000000.0,0812 2785 1663,Kurtriawan.03@gmail.com,2015.0,,,,,,,,,952,0,0,0,0,0,0,0,1,0,0,0,0,0,0,0,0,0,0,0,0,0
473,https://klikfranchise.com/services/franchisedankemitraan/detail/vwp8ynnd6jla1ezxyv2zg3karlpvordm0q9oj4kbgwlbxem7rk,Warung Warso,"Warung makan dengan konsep dan menu khas, mungkin menonjolkan cita rasa tradisional.",Food & Beverage,Waralaba,1000000.0,0877 8219 2951,warungwarso72@gmail.com,2020.0,,,,,,,,,904,0,0,0,0,0,0,0,1,0,0,0,0,0,0,0,0,0,0,0,0,0
474,https://klikfranchise.com/services/franchisedankemitraan/detail/w7zkkgjdnwv3wd0lpegymjm9wlxeoo18arql56vqypnrbax24o,Tapisi (Tahu Pisang Singkong),"Tempat yang menawarkan hidangan tahu, pisang, dan singkong dengan variasi rasa atau topping.",Food & Beverage,Waralaba,15000000.0,0812 8237 8016,tapisikrispy@gmail.com,2019.0,,,,,,,,,745,0,0,0,0,0,0,0,1,0,0,0,0,0,0,0,0,0,0,0,0,0
475,https://klikfranchise.com/services/franchisedankemitraan/detail/w86oav7lq0dexzbnpprn3w1mzdykgy9m5ajbdxkrzoeglw4vq7,Teh Mesir Mummy,Gerai minuman yang menawarkan teh dengan sentuhan Mesir atau kemasan unik.,Food & Beverage,Waralaba,3500000.0,021 6875 6475,,,,,,,,,,,312,0,0,0,0,0,0,0,1,0,0,0,0,0,0,0,0,0,0,0,0,0
476,https://klikfranchise.com/services/franchisedankemitraan/detail/w89wmpvo1mbj3exanzrga06z1347r2qjdyvyblpxkglqodew5b,soc.clean,Layanan pembersihan atau kebersihan dengan fokus pada konsep sosial atau kebersihan bersama.,Cleaning Services,Waralaba,25000000.0,0857 3694 4167,socshoesclean@gmail.com,2015.0,soc.clean.,,,,,,,,438,0,0,0,0,0,1,0,0,0,0,0,0,0,0,0,0,0,0,0,0,0
477,https://klikfranchise.com/services/franchisedankemitraan/detail/wazovbv6aklgjd015erq8dnjxaym3wwoxgl7xpyzb2nqekmp9x,The Spa Lon,Tempat spa atau pusat kecantikan dengan nama yang unik.,Health & Beauty,Waralaba,,021 6400 467,,,The Spa Lon.,,,,,,,,735,0,0,0,0,0,0,0,0,0,0,0,0,0,0,0,0,0,0,0,1,0
478,https://klikfranchise.com/services/franchisedankemitraan/detail/wbxzvlkaqdz2ab7y9ojxqyrrvnr4vwgpoepj31dek6mmlwn08e,Wow Crackers,Usaha yang menawarkan berbagai varian keripik atau crackers yang lezat dan inovatif.,Food & Beverage,Waralaba,26500000.0,021 2722 5757,,,Wow Food Industry.,,,,,,,,822,0,0,0,0,0,0,0,1,0,0,0,0,0,0,0,0,0,0,0,0,0
479,https://klikfranchise.com/services/franchisedankemitraan/detail/wedaqlndem6q5b9xvpxmvyyrzy1kggoj4zb8k7pa3ow2jlzrwl,Terang Bulan Mini Hallaland,Tempat yang menyajikan terang bulan dengan variasi topping.,Food & Beverage,Waralaba,4500000.0,031 7117 0599,,,UKM koe.,,,,,,,,795,0,0,0,0,0,0,0,1,0,0,0,0,0,0,0,0,0,0,0,0,0
480,https://klikfranchise.com/services/franchisedankemitraan/detail/wl07peyeodw3mnzvdvp6q8agb0xkboby1lq4gx2jjm9zrankwv,SOKLAT BANGET,Warung makan atau bisnis yang menawarkan hidangan dengan cokelat sebagai bahan utama.,Food & Beverage,Waralaba,7000000.0,0813 2759 7321,soklatbangeeet@gmail.com,2016.0,,,,,,,,,900,0,0,0,0,0,0,0,1,0,0,0,0,0,0,0,0,0,0,0,0,0
481,https://klikfranchise.com/services/franchisedankemitraan/detail/wl4alqkzwake6vjdnp7rzrdm9p1ooxe90n25bpx8qyybv3jgg9,Wake Cup,Warung minuman atau kafe yang menawarkan berbagai minuman segar dan mungkin menyajikan variasi kopi.,Food & Beverage,Waralaba,650000000.0,0878 7622 4666,franchise@wakecupindonesia.com,2013.0,PT Solomon Utama.,,,,,,,,959,0,0,0,0,0,0,0,1,0,0,0,0,0,0,0,0,0,0,0,0,0
482,https://klikfranchise.com/services/franchisedankemitraan/detail/wmdqankgr2w5emno7bpvaoejm73pr8kqwyx9jzlgl6yz1v04b6,Warkop Naik Kelas,"Warung kopi yang mungkin menawarkan konsep dan layanan yang ditingkatkan, menciptakan suasana kopi yang nyaman.",Food & Beverage,Waralaba,132100000.0,0813 1000 9801,kemitraan@warkopnaikkelas.com,2016.0,PT. Indosukses Makmur Berjaya.,,,,,,,,899,0,0,0,0,0,0,0,1,0,0,0,0,0,0,0,0,0,0,0,0,0
483,https://klikfranchise.com/services/franchisedankemitraan/detail/wowknmvd9bxdjr3vbz2r7mpe0v1leyn5qwajpoqgz4lkg08yxq,Twister Chips,Usaha yang menawarkan keripik atau chips dengan berbagai varian rasa dan inovasi dalam penyajian.,Food & Beverage,Waralaba,18800000.0,021 9998 8388,,,PT. Tata Cipta Mega Pelangi.,,,,,,,,823,0,0,0,0,0,0,0,1,0,0,0,0,0,0,0,0,0,0,0,0,0
484,https://klikfranchise.com/services/franchisedankemitraan/detail/wvxjnp5jo9k8gwomd3lk4ylzvxaaw62mpb7zbqxrgd1rqvyn0o,SS Wulandari,Layanan profesional yang mungkin berfokus pada kecantikan atau perawatan diri.,Health & Beauty,Waralaba,175000000.0,027 4871 027,,,,,,,,,,,446,0,0,0,0,0,0,0,0,0,0,0,0,0,0,0,0,0,0,0,1,0
485,https://klikfranchise.com/services/franchisedankemitraan/detail/ww3l98vpedngxqxgmyvq2rabrkn6ybd7ekozjmjrlpk4a51o0q,Snow Monsters,Warung makan yang menawarkan hidangan dengan variasi atau bentuk yang unik.,Food & Beverage,Waralaba,,0816 917 845,snowmonters_indonesia@yahoo.co.id,,,,,,,,,,927,0,0,0,0,0,0,0,1,0,0,0,0,0,0,0,0,0,0,0,0,0
486,https://klikfranchise.com/services/franchisedankemitraan/detail/wZk3re2OXAjPw5y8L1vVqW4JARmQ7pzG0xKodRBlYabngEMD6x,Suga Food Fried Chicken,Warung makan yang menawarkan berbagai hidangan ayam goreng dengan rasa yang unik.,Food & Beverage,Waralaba,20000000.0,021 8499 0220,,,Suga Food Indonesia.,,,,,,,,912,0,0,0,0,0,0,0,1,0,0,0,0,0,0,0,0,0,0,0,0,0
487,https://klikfranchise.com/services/franchisedankemitraan/detail/wZk3re2OXAjPw5y8L1vVqW4JARNQ7pzG0xKodRBlYabngEMD6x,Wassen Motor Indonesia,"Bisnis di bidang otomotif, mungkin menawarkan layanan perawatan dan perbaikan motor.",Automotive,Waralaba,65000000.0,031 6067 6744,,,CV Mulia Mandiri.,,,,,,,,130,0,0,0,0,1,0,0,0,0,0,0,0,0,0,0,0,0,0,0,0,0
488,https://klikfranchise.com/services/franchisedankemitraan/detail/wzpwo9mwgkaevk4o2an5gyylxbq7qe3mbjnx1dr0lxp6rbjzvw,Tea Break,Tempat untuk istirahat dan menikmati berbagai jenis teh.,Food & Beverage,Waralaba,128000000.0,0878 4222 0111,marketing.transindoinnovative@gmail.com,2017.0,PT Transindo Innovative Aroma.,,,,,,,,736,0,0,0,0,0,0,0,1,0,0,0,0,0,0,0,0,0,0,0,0,0
489,https://klikfranchise.com/services/franchisedankemitraan/detail/x7npJ1Xx0AYEV824MNlKZaGgN0md6LeQbOD3jPyRqoBkzwrvWK,Singkong Keju Katrocker,Warung makan yang menawarkan hidangan singkong keju dengan nuansa rock atau keren.,Food & Beverage,Waralaba,10000000.0,0511 7640 737,,,PT Karunia.,,,,,,,,929,0,0,0,0,0,0,0,1,0,0,0,0,0,0,0,0,0,0,0,0,0
490,https://klikfranchise.com/services/franchisedankemitraan/detail/x8aqbvl1npk4bnd2lazjpjog51g0dw5rekmoqx3gewyz796yxj,Teh Segerrr,Tempat yang menyajikan teh dengan kesegaran yang diungkapkan dalam namanya.,Food & Beverage,Waralaba,6500000.0,0852 0382 4860,tehsegerrr.bdg@gmail.com,2018.0,PT Mistersiap Indonesia Kreatif.,,,,,,,,793,0,0,0,0,0,0,0,1,0,0,0,0,0,0,0,0,0,0,0,0,0
491,https://klikfranchise.com/services/franchisedankemitraan/detail/x8mlkqjlzyxdrnavxae3op6wnkvpwgyj57neb04rmkdg2ob1z2,YASAKA Fried Chicken,"Fried chicken dengan cita rasa khas YASAKA, mungkin dengan bumbu atau resep yang memberikan sentuhan Jepang pada hidangan.",Food & Beverage,Waralaba,9000000.0,0813 5786 5553,c4smarketing86@gmail.com,2010.0,PT. Cipta Aneka Selera.,,,,,,,,276,0,0,0,0,0,0,0,1,0,0,0,0,0,0,0,0,0,0,0,0,0
492,https://klikfranchise.com/services/franchisedankemitraan/detail/x8z6odkey0naro7kyqg2rpvvn1p4blnw3m91exj5zbwgjxdal7,Star Express,Perusahaan yang berpengalaman dalam menyediakan solusi pengiriman barang baik ekspor impor maupun pengiriman dalam negeri.,Logistics,Waralaba,10000000.0,0811 8492 244,office@starexpressindonesia.com,,PT Star Express Indonesia.,,,,,,,,579,0,0,0,0,0,0,0,0,0,0,1,0,0,0,0,0,0,0,0,0,0
493,https://klikfranchise.com/services/franchisedankemitraan/detail/x9v256npae3ayq0xk7onjl8rq6bklymm1bw4dzervzggpjqdxb,Warunk Level Up Express,"Versi ekspres dari Warunk Level Up, mungkin dengan fokus pada layanan cepat saji.",Food & Beverage,Waralaba,300000000.0,0821 2989 8912,leo.sukrisna@gmail.com,,,,,,,,,,832,0,0,0,0,0,0,0,1,0,0,0,0,0,0,0,0,0,0,0,0,0
494,https://klikfranchise.com/services/franchisedankemitraan/detail/xbowpxgovz0vklm6mrarbeqx0kz8jnakdyl2np7dj13gqe5yww,Warteg Putra Bahari,"Warung tegal yang menawarkan berbagai hidangan nasi, lauk, dan sayuran dengan konsep khas warteg.",Food & Beverage,Waralaba,140000000.0,0813 8872 0001,wategbahari@yahoo.com,2014.0,,,,,,,,,968,0,0,0,0,0,0,0,1,0,0,0,0,0,0,0,0,0,0,0,0,0
495,https://klikfranchise.com/services/franchisedankemitraan/detail/xeozqgxlvjwwmbm4a7d3q18gzkbnkepa0rvx6pjzyy2do9lnky,Takadeli Cake Boutique,Tempat yang menyajikan kue-kue dalam bentuk boutique atau butik.,Food & Beverage,Waralaba,146000000.0,0811 7040 300,cs@takadeli.com,2007.0,,,,,,,,,769,0,0,0,0,0,0,0,1,0,0,0,0,0,0,0,0,0,0,0,0,0
496,https://klikfranchise.com/services/franchisedankemitraan/detail/xlogwxabe5j1d2nokw7gzqlnv1r8k9vdpmyrxvb436j0aymqev,"Siomay Bandung Asli ""Kang Otong""","Siomay Bandung Asli ""Kang Otong"" adalah tempat makan yang mengkhususkan diri dalam menyajikan Siomay Bandung asli, yaitu sejenis dimsum ikan tradisional Indonesia",Food & Beverage,Waralaba,70000000.0,088 8273 4990,,,,,,,,,,,655,0,0,0,0,0,0,0,1,0,0,0,0,0,0,0,0,0,0,0,0,0
497,https://klikfranchise.com/services/franchisedankemitraan/detail/xnrpx8dae06ygkm45jqnrq1bvqm3bd7g9z2pklewjovxalvyo0,Semesta Sliky Puding,Semesta Sliky Puding adalah tempat yang menawarkan puding lembut,Food & Beverage,Waralaba,4800000.0,0878 3285 3404,Mommilkgroup@gmail.com,2019.0,,,,,,,,,649,0,0,0,0,0,0,0,1,0,0,0,0,0,0,0,0,0,0,0,0,0
498,https://klikfranchise.com/services/franchisedankemitraan/detail/xokmodxr4b7evnk8znl3xqvgngpyz0wdep2lmqg6j59b1jywad,Tahu Gila,Tahu Gila adalah tempat yang dikenal karena penyajian uniknya pada hidangan berbahan dasar tahu,Food & Beverage,Waralaba,5700000.0,0822 2559 1182,tahugila.id@gmail.com,2013.0,,,,,,,,,695,0,0,0,0,0,0,0,1,0,0,0,0,0,0,0,0,0,0,0,0,0
499,https://klikfranchise.com/services/franchisedankemitraan/detail/xpe93gdz7jrbrnm0l1bzvgqmbpa4ylykdoxwje8n62wvpxkaoq,Starkult,Starkult membuka usaha minuman yang mencampurkan Yakult dengan minuman buah lainnya.,Food & Beverage,Waralaba,9900000.0,0811 2953 458,plazakulinerofficial@gmail.com,2018.0,PT. PLAZA KULINER INDONESIA.,,,,,,,,673,0,0,0,0,0,0,0,1,0,0,0,0,0,0,0,0,0,0,0,0,0
500,https://klikfranchise.com/services/franchisedankemitraan/detail/xqvylgb28v0byjzozwxk1jl51gmwoxnnaraemdepq4g367k9pw,Win Market,Franchise supermarket atau pasar ritel yang mungkin menonjolkan konsep pelayanan pelanggan yang baik dan variasi produk yang lengkap.,Fashion,Waralaba,15000000.0,0813 6192 0003,,,Win Market Online Group.,,,,,,,,259,0,0,0,0,0,0,0,0,0,0,0,0,0,0,0,0,1,0,0,0,0
501,https://klikfranchise.com/services/franchisedankemitraan/detail/xrdazbko7mrgexwpvqm9bxjpbnpgwl52d4y3vj16nna8zo0ke9,Spaethi House,THE SPAGHETTI HOUSE sangat ingin memperluas pasar internasionalnya terutama melalui jaringan waralaba di wilayah Asia Tenggara,Food & Beverage,Waralaba,,021 6918 925,,,PT. Pastramas.,,,,,,,,687,0,0,0,0,0,0,0,1,0,0,0,0,0,0,0,0,0,0,0,0,0
502,https://klikfranchise.com/services/franchisedankemitraan/detail/xvm85rjy7x1bkwydwlak94ezrenegd3zvmx0nqpborao26lqgk,Sosis Bakar Asmara,Sosis Bakar Asmara adalah tempat yang mengkhususkan diri dalam menyajikan sosis bakar,Food & Beverage,Waralaba,4000000.0,0812 3481 928,sosisbakarasmara@gmail.com,2014.0,,,,,,,,,659,0,0,0,0,0,0,0,1,0,0,0,0,0,0,0,0,0,0,0,0,0
503,https://klikfranchise.com/services/franchisedankemitraan/detail/xxmx8dvzrknqw3py9j2g7lg6e7dbpwor5envola01kyem4abzv,Wano Boba Tea,Franchise minuman boba yang mungkin menawarkan variasi minuman boba dengan konsep dan cita rasa yang unik.,Food & Beverage,Waralaba,5900000.0,0821 3392 0585,,2018.0,Mitra Creator Indonesia.,,,,,,,,248,0,0,0,0,0,0,0,1,0,0,0,0,0,0,0,0,0,0,0,0,0
504,https://klikfranchise.com/services/franchisedankemitraan/detail/xxo2o0k5gmaa4q1eb3dkrprq0dq6mwz9pngjexvnbd7lwyzvyw,Yakamu Boba,"Franchise minuman boba yang mungkin menonjolkan keunikan dalam penyajian dan rasa, menciptakan minuman yang istimewa.",Food & Beverage,Waralaba,3800000.0,0821 4372 6717,yakamuboba@gmail.com,2020.0,,,,,,,,,249,0,0,0,0,0,0,0,1,0,0,0,0,0,0,0,0,0,0,0,0,0
505,https://klikfranchise.com/services/franchisedankemitraan/detail/xxog7xv8rybq9zw42agyej0kpwd6amvlqbo5pnp13zkrwedlmb,Tuft Kote Dinol,Mungkin merupakan bisnis layanan perawatan mobil dengan fokus pada produk atau layanan penjagaan kote (cat mobil).,Automotive,Kemitraan,,021 4243 259,,2003.0,PT. Antika Jaya Utama.,,,,,,,,542,0,0,0,0,1,0,0,0,0,0,0,0,0,0,0,0,0,0,0,0,0
506,https://klikfranchise.com/services/franchisedankemitraan/detail/y0kdxzxagn1klzamy4vdo5v3y7epbrl97w28yjjpgnwbmqreqr,Wet Klin Cleaning Shop,Layanan pembersihan dan laundry yang mungkin menonjolkan konsep kebersihan dan kenyamanan pelanggan.,Cleaning Services,Waralaba,1100000000.0,021 5315 8232,,2009.0,PT. Wetklin Indonesia.,,,,,,,,440,0,0,0,0,0,1,0,0,0,0,0,0,0,0,0,0,0,0,0,0,0
507,https://klikfranchise.com/services/franchisedankemitraan/detail/yabnkxeyb3kppyqlov0872vxw9gd19ermwgmodjqlwjn5zz468,WISCO,Bisnis yang mungkin bergerak di bidang teknologi atau layanan IT dengan fokus pada solusi perangkat lunak.,Food & Beverage,Waralaba,5000000.0,0857 0222 2138,wisco.chocolate@gmail.com,2011.0,KOES ISLAND GROUP.,,,,,,,,146,0,0,0,0,0,0,0,1,0,0,0,0,0,0,0,0,0,0,0,0,0
508,https://klikfranchise.com/services/franchisedankemitraan/detail/yanzlvmw2kej1rpajdk5ooxpjprqmb3b4n0l69yygvegx7d8q4,Uncle Bob Ice Cream Sandwich,Franchise yang menawarkan es krim dalam bentuk sandwich dengan variasi rasa yang unik.,Food & Beverage,Waralaba,10000000.0,0856 3080 914,,,PT. Kebab Kings Indonesia.,,,,,,,,265,0,0,0,0,0,0,0,1,0,0,0,0,0,0,0,0,0,0,0,0,0
509,https://klikfranchise.com/services/franchisedankemitraan/detail/yddvmwy8xwjb6ake40xzqk57beneg1nlapzoygj2bo3lmvqrp2,Tahu Garing TAGAR,"Tahu Garing TAGAR adalah brand Tahu Crispy No.1 di Indonesia, dengan total lebih dari 200 gerai yang tersebar di seluruh Indonesia. Tahu Garing menawarkan produk berwari-wari, termasuk Tahu Garing pake Isi Sambal yang menjadi produk berkelanjutan di Indonesia",Food & Beverage,Waralaba,15000000.0,0815 1108 8116,tahugaring_tagar@hotmail.com,2019.0,CV Tahu Garing TAGAR.,,,,,,,,693,0,0,0,0,0,0,0,1,0,0,0,0,0,0,0,0,0,0,0,0,0
510,https://klikfranchise.com/services/franchisedankemitraan/detail/ye4glzawpd7xdkn8k3r0jwmaw651obpmjvyqzb9y2re6nlvox7,Warung Roster,Mungkin merupakan warung makan yang menawarkan menu dengan konsep panggang atau bakar.,Food & Beverage,Waralaba,,0878 5192 5550,,2017.0,,,,,,,,,548,0,0,0,0,0,0,0,1,0,0,0,0,0,0,0,0,0,0,0,0,0
511,https://klikfranchise.com/services/franchisedankemitraan/detail/yg5ebnjkezdgoqvlb8pnwamyv8o2pzd97mkv4jarlyr03xq1wd,UDANG LOVERS SOLO,Mungkin merupakan warung atau bisnis yang menawarkan hidangan udang dengan berbagai varian rasa dan olahan.,Food & Beverage,Waralaba,7600000.0,0877 0014 0664,udangloversindonesia@gmail.com,2017.0,,,,,,,,,547,0,0,0,0,0,0,0,1,0,0,0,0,0,0,0,0,0,0,0,0,0
512,https://klikfranchise.com/services/franchisedankemitraan/detail/yk5pyp21qaqdbawllkn04dnrzw9xvgmzo876oebzmx3ryewvja,Suga F&B Fried Chiken,Suga F&B Fried Chicken menawarkan makanan fried chicken dengan rasa dan kualitas yang menarik,Food & Beverage,Waralaba,200000000.0,021 9126 11100,,2005.0,,,,,,,,,678,0,0,0,0,0,0,0,1,0,0,0,0,0,0,0,0,0,0,0,0,0
513,https://klikfranchise.com/services/franchisedankemitraan/detail/yog4d7wdnm0wzble9vpjamongmqvry3r2qlpex1jkk8gz6xbym,Steak and Cheese,Steak and Cheese menawarkan berbagai jenis steak dan keju terbaik.,Food & Beverage,Waralaba,100000000.0,0812 2667 7364,Steakandcheese888@gmail.com,2017.0,Ideax Creative Culinary.,,,,,,,,675,0,0,0,0,0,0,0,1,0,0,0,0,0,0,0,0,0,0,0,0,0
514,https://klikfranchise.com/services/franchisedankemitraan/detail/yoybrkdlmqd7n34epmz8vywgbqbljwaa29nqx01pgvjkreo6xr,Waralabakopi [dot] Com,"Franchise kopi yang mungkin beroperasi secara daring atau online, menawarkan layanan pesan antar atau keanggotaan kopi.",Food & Beverage,Waralaba,9700000.0,0812 3204 0003,tony.s.u.333@gmail.com,2009.0,,,,,,,,,232,0,0,0,0,0,0,0,1,0,0,0,0,0,0,0,0,0,0,0,0,0
515,https://klikfranchise.com/services/franchisedankemitraan/detail/yqgqwn81xd2l6zx7y5mone0vb8a4larrjjkepzb9p3bovydkm8,Ta B'nana,Ta B'nana menawarkan produk berkelanjutan yang terbuat dari bahan mentah yang terbaik dan alami,Food & Beverage,Waralaba,17000000.0,0812 8045 939,smartme1@indosat.net.id,,,,,,,,,,690,0,0,0,0,0,0,0,1,0,0,0,0,0,0,0,0,0,0,0,0,0
516,https://klikfranchise.com/services/franchisedankemitraan/detail/yvr5q2b3pgme0gn7zlrnjaq6adbdvkdjx4ylzmawx9wo1opke2,Xiblackboba,"Menyediakan minuman boba dengan sentuhan khusus pada rasa dan penyajian, menciptakan pengalaman boba yang berbeda.",Food & Beverage,Waralaba,5600000.0,0812 8045 939,smartme1@indosat.net.id,,,,,,,,,,521,0,0,0,0,0,0,0,1,0,0,0,0,0,0,0,0,0,0,0,0,0
517,https://klikfranchise.com/services/franchisedankemitraan/detail/yvyabo35ewjwn6ljlrq4q0b2g9gre7zmd8n9xokxyzpvkm1ag8,Sepisang,Sepisang menawarkan berbagai produk makananan yang lezat dan sehat,Food & Beverage,Waralaba,8500000.0,0853 3470 4411,,2020.0,,,,,,,,,650,0,0,0,0,0,0,0,1,0,0,0,0,0,0,0,0,0,0,0,0,0
518,https://klikfranchise.com/services/franchisedankemitraan/detail/zewve46lqmzakbx7vwnl2jjrml5pn0dxdpkyo9grgyb3oa18mb,Tahu Hot King,Tempat yang menyajikan tahu dengan kepedasan tinggi (Hot King).,Food & Beverage,Waralaba,6900000.0,0812 1653 1177,tahuhotking@gmail.com,,,,,,,,,,776,0,0,0,0,0,0,0,1,0,0,0,0,0,0,0,0,0,0,0,0,0
519,https://klikfranchise.com/services/franchisedankemitraan/detail/zje03lvqr54p9zj8dwy72eoznjzg1xwanpnkmlbyambk6dgoqv,Softcase Laptop Icainu,Softcase Laptop Icainu menawarkan berbagai produk softcase laptop dengan desain yang menarik dan fungsional,Technology,Waralaba,5000000.0,021 9955 2815,,,Icainu.,,,,,,,,658,0,0,0,0,0,0,0,0,0,0,0,0,0,0,0,0,0,0,0,0,1
520,https://klikfranchise.com/services/franchisedankemitraan/detail/zlweej84qmgadrdngokqy2lbnevjzxrm0k39pan5o1wby7z6pm,Sweets & Sour Shaved Ice,Sweets & Sour Shaved Ice menawarkan es krim yang dihias dengan buah dan rasa yang menarik,Food & Beverage,Waralaba,25000000.0,021 5822 076,,,,,,,,,,,684,0,0,0,0,0,0,0,1,0,0,0,0,0,0,0,0,0,0,0,0,0
