,franchise_href,franchise_name,description,franchise_category,franchise_type,costs,phone_number,email_address,year_established,company_name,company_address,country,currency,license_duration_in_years,net_profits_per_month,return_of_investments,royalty_fees_per_month,labels,,19,Education,Transportation,Automotive,Cleaning Services,Tour & Travel,Food & Beverage,Jasa Logistics,Hobby & Entertainment,Logistics,Beauty & Healthy,Teknologi,Cleaninf Servces,Retail & Minimarket,Advertising,Fashion,Finance,Food & Beverage Shop,Health & Beauty,Technology
168,https://franchisepedia.id/listing/vossairminum/,Voss Air Minum,"PT Waralaba VOSS Indonesia atau VOSS Indonesia adalah perusahaan bisnis Franchise Depot Air Minum Isi Ulang yang berdiri sejak tahun 2018 dibawah bendera PT. Mandiri Sejahtera Alami (MSA) Group. VOSS hadir dengan konsep bisnis AUTOPILOT dengan tujuan untuk memudahkan para investor dalam memulai bisnisnya bersama VOSS. Sistem AUTOPILOT itu sendiri meliputi kemudahan yang diberikan VOSS kepada investor dalam merekrut karyawan (SDM), pengadaan material produk (mata air, tissue dan tutup galon), promosi atau marketing, perawatan mesin serta rakapitulasi penjualan. Dengan adanya kemudahan ini, VOSS berharap akan banyak investor yang menjadi bagian dari pertumbuhan bisnis air minum isi ulang ini.",Food & Beverage,Kemitraan,310000000.0,,,,,,Indonesia,,,,30 Bulan,310%,568,0,0,0,0,0,0,0,1,0,0,0,0,0,0,0,0,0,0,0,0,0
169,https://franchisepedia.id/listing/waroengsambalbakar/,Waroeng Sambal Bakar,"PT. Davin Galuh Partner adalah perusahaan yang bergerak di bisnis F&B yang berdiri pada tahun 2021. PT. DGP memiliki beberapa brand antara lain Waroeng Sambal Bakar, BRO KITCHEN, Ketoprak WOW, Ayam Bebek Padeh, Nasi Kulit Padeh, Ayam Bakar Mr.Bro, dan Kopi en Tea yang sudah tersebar 70 outlet di seluruh wilayah Indonesia.",Food & Beverage,Waralaba,120000000.0,,,,,,Indonesia,,,,7 bulan,"1,5 juta/bulan",569,0,0,0,0,0,0,0,1,0,0,0,0,0,0,0,0,0,0,0,0,0
170,https://franchisepedia.id/listing/wongpotato/,Wong Potato,"Wong aPotato adalah brand ke3 dari JP Group yang menggandeng salah satu influencer ternama Indonesia yaitu Baim Wong. Bermulla di awal September 2021 hingga September 2022. Wong Potato telah mencapai hampir 350 outlet, baik di Pulau Jawa maupun di luar Pulai Jawa. Hanya dengan Rp 12.000 sudah dapat menikmati crunchy dan gurihnya Wong Potato. Serta banyak varian rasa, membuat Wong Potato menjadi cemilan favorit di semua kalangan.",Food & Beverage,Waralaba,13900000.0,,,,,,Indonesia,,,,23 Bulan,Tidak ada,977,0,0,0,0,0,0,0,1,0,0,0,0,0,0,0,0,0,0,0,0,0
171,https://klikfranchise.com/services/franchisedankemitraan/detail/03v54l1rkx0qpnvd2moxejdwzx9pbanqglmey7arzkogwy6jzz,Ziebart,"Mungkin merupakan usaha yang fokus pada layanan perawatan dan pelindungan kendaraan, seperti detailing dan pengecatan.",Automotive,Kemitraan,34233000.0,021 4203 000,,,Zindo Utama.,,,,,,,,545,0,0,0,0,1,0,0,0,0,0,0,0,0,0,0,0,0,0,0,0,0
172,https://klikfranchise.com/services/franchisedankemitraan/detail/0d0nx189obryva23ekabjlz654dlzjmwgwxqr5yknmvp4pgeoq,TIKI,Mungkin merupakan perusahaan kurir atau layanan pengiriman barang.,Logistics,Kemitraan,10000000.0,1500125,tiki@tiki.id,1970.0,PT CITRA VAN TITIPAN KILAT.,,,,,,,,544,0,0,0,0,0,0,0,0,0,0,1,0,0,0,0,0,0,0,0,0,0
173,https://klikfranchise.com/services/franchisedankemitraan/detail/0eayl1a7bk48zdyrmexn3vx5a0rw902bqjpo6nqjpomdglzgko,Tian Tang,Nama yang mungkin terkait dengan restoran atau gerai makanan.,Food & Beverage,Waralaba,85000000.0,0812 1340 3023,hongtang.franchise@gmail.com,2012.0,,,,,,,,,549,0,0,0,0,0,0,0,1,0,0,0,0,0,0,0,0,0,0,0,0,0
174,https://klikfranchise.com/services/franchisedankemitraan/detail/0m7lym0qlvwgkyqjeaowr4rvendngzbbz19oxk6x2j3anp85dw,Yoshiku Bento,"Franchise bento dengan variasi menu yang beragam, mungkin dengan sentuhan kreatif dan cita rasa yang autentik.",Food & Beverage,Waralaba,15000000.0,021 7871 079,,,,,,,,,,,228,0,0,0,0,0,0,0,1,0,0,0,0,0,0,0,0,0,0,0,0,0
175,https://klikfranchise.com/services/franchisedankemitraan/detail/0x6dpp0l54rawz1z27okmdwyxwjyeokb93nng8avjxbqeqglvz,Sop Ikan Batam,Warung makan yang menawarkan hidangan sop ikan khas Batam.,Food & Beverage,Waralaba,100000000.0,021 4585 1072,,,PT Sop Ikan Batam.,,,,,,,,932,0,0,0,0,0,0,0,1,0,0,0,0,0,0,0,0,0,0,0,0,0
176,https://klikfranchise.com/services/franchisedankemitraan/detail/0z79bbrjwpo6kgyqo1q0zm8vz9ajednalxwrnedkl52ym3p4xb,YIPPIE DRINK,Franchise minuman yang menawarkan berbagai minuman segar dengan sentuhan kreatif dan keceriaan.,Food & Beverage,Waralaba,2500000.0,0838 6540 5282,husin_fahmi22@yahoo.com,2018.0,YIPPIE DRINK.,,,,,,,,251,0,0,0,0,0,0,0,1,0,0,0,0,0,0,0,0,0,0,0,0,0
177,https://klikfranchise.com/services/franchisedankemitraan/detail/115xk3bgnjepwwvmpr074norawq6mya2glxdv89akbyejqdloa,Sger Drinks,Warung minuman dengan berbagai pilihan minuman segar dan kreatif.,Food & Beverage,Waralaba,,0812 9292 8010,sgerdrink@gmail.com,2019.0,,,,,,,,,960,0,0,0,0,0,0,0,1,0,0,0,0,0,0,0,0,0,0,0,0,0
178,https://klikfranchise.com/services/franchisedankemitraan/detail/19zyqk3vxl4wq8wabknor56gqpg0lpedpzjde17nmyamxbojvz,Toper Buble Drink,Gerai minuman spesialis dalam minuman bergelembung (bubble drink).,Food & Beverage,Waralaba,3900000.0,026 4315 521,,,Mathena Group.,,,,,,,,301,0,0,0,0,0,0,0,1,0,0,0,0,0,0,0,0,0,0,0,0,0
179,https://klikfranchise.com/services/franchisedankemitraan/detail/1l6egm9gyeyaqo0m4zklp7jbdgnzarjrxdp18kv5d3nvo2xbwn,Warung Kudeta 1945,Warung makan dengan konsep khas dan menyajikan hidangan khas sejarah tahun 1945.,Food & Beverage,Waralaba,,0812 6160 1466,,2018.0,The Aroma Group.,,,,,,,,905,0,0,0,0,0,0,0,1,0,0,0,0,0,0,0,0,0,0,0,0,0
180,https://klikfranchise.com/services/franchisedankemitraan/detail/1mdqrxgloganpdkalbwv73kqnym5j0pwebx29zvrz6yye841nn,Waroeng Mee,Warung makan yang menawarkan berbagai hidangan mie dari berbagai daerah.,Food & Beverage,Waralaba,700000000.0,,waroeng.mee@gmail.com,,,,,,,,,,914,0,0,0,0,0,0,0,1,0,0,0,0,0,0,0,0,0,0,0,0,0
181,https://klikfranchise.com/services/franchisedankemitraan/detail/1mgvjqyo1xk7nwa3w5v48zjr7x6zdlbrkynqbegxo9elamppdb,Soto Gebrak Cak Anton,Warung makan yang terkenal dengan hidangan soto gebrak khas Cak Anton.,Food & Beverage,Waralaba,,021 5251 975,,,,,,,,,,,956,0,0,0,0,0,0,0,1,0,0,0,0,0,0,0,0,0,0,0,0,0
182,https://klikfranchise.com/services/franchisedankemitraan/detail/1mxpj8ljavlww1amkke90rvp9nngqg5bodyxzeody32n6zrq7p,Steaknation,Restoran yang mengkhususkan diri dalam hidangan steak dengan berbagai varian.,Food & Beverage,Waralaba,35000000.0,0813 3313 3647,Peloporbaksosteak@yahoo.com,,CV. PELAPOR BAKSO STEAK INDONESIA.,,,,,,,,616,0,0,0,0,0,0,0,1,0,0,0,0,0,0,0,0,0,0,0,0,0
183,https://klikfranchise.com/services/franchisedankemitraan/detail/1qk1nz3ybzdobdqpgmypwgav91v7xj9ee6lxa2o8ml0rrn4jko,Upsolute Coffee,Warung kopi yang menawarkan kopi berkualitas tinggi dengan konsep dan layanan yang ditingkatkan.,Food & Beverage,Waralaba,135000000.0,0898 9609 889,upsolutecoffee@gmail.com,2018.0,PT. Mamindo Sukses Bersama.,,,,,,,,897,0,0,0,0,0,0,0,1,0,0,0,0,0,0,0,0,0,0,0,0,0
184,https://klikfranchise.com/services/franchisedankemitraan/detail/1zqa6regydjdebnqvonkkm45m15mlr1bw7p28xy39pj0ovalgl,Warteg Kharisma Bahari,Warung tegal dengan konsep dan layanan yang menciptakan pengalaman makan yang nyaman dan bersahabat.,Food & Beverage,Waralaba,140000000.0,87889530004,Groupwkb@gmail.com,,Warteg Kharisma Bahari Group.,,,,,,,,967,0,0,0,0,0,0,0,1,0,0,0,0,0,0,0,0,0,0,0,0,0
185,https://klikfranchise.com/services/franchisedankemitraan/detail/27xkn3ovbpbygo5kqjymwr4wmyw1lzdde6n98mj2rzvqle0apr,Tokyo Ramen,Restoran ramen Jepang yang menawarkan berbagai jenis ramen.,Food & Beverage,Waralaba,10000000.0,0857 2502 3741,tokyoramenindonesia@gmail.com,2009.0,,,,,,,,,611,0,0,0,0,0,0,0,1,0,0,0,0,0,0,0,0,0,0,0,0,0
186,https://klikfranchise.com/services/franchisedankemitraan/detail/2keqnlwb5j2y0wd37zox4yzvwqjp9qegv1rgmr6dmkabaxnolg,Zuper Thai Tea,"Menawarkan minuman Thai tea dengan variasi rasa yang beragam, mungkin dengan tambahan unik yang membuatnya ""zuper.""",Food & Beverage,Waralaba,2999000.0,0822 3163 9886,,2021.0,,,,,,,,,492,0,0,0,0,0,0,0,1,0,0,0,0,0,0,0,0,0,0,0,0,0
187,https://klikfranchise.com/services/franchisedankemitraan/detail/2km8epbqmrv9bkazgw0g43ajeo7enlqo5ddp2vy1jxn6xyozw6,Travel Coffee,Warung kopi dengan konsep yang terkait dengan tema perjalanan atau traveling.,Food & Beverage,Waralaba,,081 7723 036,cipta.wisata@yahoo.co.od,,PT.Cipta Wisata Mandiri.,,,,,,,,895,0,0,0,0,0,0,0,1,0,0,0,0,0,0,0,0,0,0,0,0,0
188,https://klikfranchise.com/services/franchisedankemitraan/detail/2lqjjpe84x5qznvxzwpg0rkrv1v3owk6dobgne1ydb72m9lyag,The Bizztro,Tempat makan atau bisnis kuliner dengan sentuhan bisnis atau profesional.,Food & Beverage,Waralaba,,027 1669 977,,,PT. Choice Plus Indonesia.,,,,,,,,704,0,0,0,0,0,0,0,1,0,0,0,0,0,0,0,0,0,0,0,0,0
189,https://klikfranchise.com/services/franchisedankemitraan/detail/2o3q0q7yjyxklprep1znbvmd6m4ndazm2elw6gj5b8wax9rvgy,Takoyaki Yakinenak,Tempat yang menawarkan takoyaki dengan cita rasa yang lezat atau enak.,Food & Beverage,Waralaba,7000000.0,081 665 7296,Noormans1965@gmail.com,2005.0,CV. Budiman Guna Utama.,,,,,,,,750,0,0,0,0,0,0,0,1,0,0,0,0,0,0,0,0,0,0,0,0,0
190,https://klikfranchise.com/services/franchisedankemitraan/detail/2orp0lxvmnqlmgqby9bn7r8e7do3vp6ykaxzeajww4g2d5kzdw,Synergi Kinetics,Restoran dengan konsep menyajikan hidangan yang bersinergi dan dinamis.,Food & Beverage,Waralaba,40000000.0,021 5750 420,,2008.0,,,,,,,,,610,0,0,0,0,0,0,0,1,0,0,0,0,0,0,0,0,0,0,0,0,0
191,https://klikfranchise.com/services/franchisedankemitraan/detail/2orp0lxvmnqlmgqby9bn7r8e7do3vp6ykaxzeajww4g2d5kzdw,Yakitori Box,Menyajikan hidangan yakitori (panggangan ayam) dengan berbagai varian rasa dan saus yang lezat.,Food & Beverage,Waralaba,40000000.0,0813 8896 0719,yakitoribox.official@gmail.com,2017.0,PT robert group abadi.,,,,,,,,511,0,0,0,0,0,0,0,1,0,0,0,0,0,0,0,0,0,0,0,0,0
192,https://klikfranchise.com/services/franchisedankemitraan/detail/2rx7jmd841qkqnebpwjoad3vp690ylomgw5pl2zae6zrgynkx7,Yourthai Tea,Franchise minuman Thai tea dengan konsep yang menonjolkan rasa otentik dan kualitas bahan baku terbaik.,Food & Beverage,Waralaba,15000000.0,0857 3097 3550,info@yourthaitea.com,2017.0,,,,,,,,,240,0,0,0,0,0,0,0,1,0,0,0,0,0,0,0,0,0,0,0,0,0
193,https://klikfranchise.com/services/franchisedankemitraan/detail/2wol5b7wdjr8ny4ejxrpgvbq7no1lqyadmemznk29z0gv63kx3,Serabi Solo D Java,Warung makan yang mengkhususkan diri dalam menyajikan serabi khas Solo dengan cita rasa autentik.,Food & Beverage,Waralaba,7500000.0,0813 8625 0100,info@serabienak.com,2010.0,,,,,,,,,945,0,0,0,0,0,0,0,1,0,0,0,0,0,0,0,0,0,0,0,0,0
194,https://klikfranchise.com/services/franchisedankemitraan/detail/30w2yka93nel1xynjkom6vzmvlzo7lw4r5xeajbp8dqdvqgbg5,Wellfarm,"Bisnis yang bergerak di bidang pertanian atau kesehatan, mungkin menawarkan produk-produk organik atau suplemen.",Food & Beverage,Kemitraan,11000000.0,0878 6778 3328,wellfarm.id@gmail.com,2021.0,PT Galery Investama Semesta.,,,,,,,,136,0,0,0,0,0,0,0,1,0,0,0,0,0,0,0,0,0,0,0,0,0
195,https://klikfranchise.com/services/franchisedankemitraan/detail/3301qlajmp2yx9obpwz5kmej2po64dgvarz8vgr7nbekwqnylb,Soto Mat Tjangkir,Warung makan yang terkenal dengan hidangan soto Mat Tjangkir yang lezat.,Food & Beverage,Waralaba,45000000.0,0812 2931 022,sotomattjangkir@gmail.com,2000.0,,,,,,,,,955,0,0,0,0,0,0,0,1,0,0,0,0,0,0,0,0,0,0,0,0,0
196,https://klikfranchise.com/services/franchisedankemitraan/detail/3gpmow1yldqq4k0jle2nv39dbndkraejgvyxw76m8axzopbbrl,Wedang Wayang,Warung minuman tradisional yang menawarkan wedang (minuman hangat berbumbu) dengan konsep dan variasi rasa yang khas.,Food & Beverage,Waralaba,45000000.0,027 4625 082,,,CV Duta Kencana.,,,,,,,,961,0,0,0,0,0,0,0,1,0,0,0,0,0,0,0,0,0,0,0,0,0
197,https://klikfranchise.com/services/franchisedankemitraan/detail/3j9yn7akb2lo63kolpre1yvnbbngm40xd8qdr5mvwabpegwxz0,The Daily Wash Laundromat,Layanan laundry harian atau laundromat.,Cleaning Services,Kemitraan,5000000.0,0812 999 7434,admin@thedailywash.co.id,2007.0,,,,,,,,,430,0,0,0,0,0,1,0,0,0,0,0,0,0,0,0,0,0,0,0,0,0
198,https://klikfranchise.com/services/franchisedankemitraan/detail/3y6pymanav3wvdn5xg0koj47z27przq1drlq9kgw2ezbjlob8q,SEMURIL,Layanan perawatan dan kesehatan dengan fokus pada konsep perawatan ekstra (extra care).,Health & Beauty,Kemitraan,476200000.0,0811 919 962,semurilnusantaraindonesia@gmail.com,,PT. SEMURIL NUSANTARA INDONESIA.,,,,,,,,444,0,0,0,0,0,0,0,0,0,0,0,0,0,0,0,0,0,0,0,1,0
199,https://klikfranchise.com/services/franchisedankemitraan/detail/3yrok5p1ybw8zwd9mlaqaejm5mm46dgnej0lq2nxgxovr3v7kx,XTO Care,Layanan perawatan dan kesehatan dengan fokus pada konsep perawatan ekstra (extra care).,Automotive,Kemitraan,300000000.0,021 2943 8375,info@xtocarcare.com,2018.0,MAKKO Group.,,,,,,,,444,0,0,0,0,1,0,0,0,0,0,0,0,0,0,0,0,0,0,0,0,0
200,https://klikfranchise.com/services/franchisedankemitraan/detail/4178qknn4m9pqe0ayvb5jzyvgjwzwped2rg36xgjbkaolrlodr,Tahu Brintik Crispy,Warung makan yang terkenal dengan tahu brintik crispy yang lezat.,Food & Beverage,Waralaba,200000000.0,031 7161 8111,,,CV Boga Nusa Jaya.,,,,,,,,958,0,0,0,0,0,0,0,1,0,0,0,0,0,0,0,0,0,0,0,0,0
201,https://klikfranchise.com/services/franchisedankemitraan/detail/4g9znlarw3bekopdj158bqxvp0v0konqyxwae4dvzpjlmmygrr,Wing Stop,"Terkenal dengan ayam goreng dan sausnya yang beragam, menciptakan pilihan lezat untuk para penggemar ayam.",Food & Beverage,Waralaba,6000000.0,021 7179 4900,wingstop@mahadya.co.id,1997.0,Wingstop Franchising LLC.,,,,,,,,802,0,0,0,0,0,0,0,1,0,0,0,0,0,0,0,0,0,0,0,0,0
202,https://klikfranchise.com/services/franchisedankemitraan/detail/4kqxonwjnbm5ylprevjwplqgywdo28z3ab4ymea1xdv6kgz09o,Vanbury Chocomelted,Bisnis yang menawarkan produk cokelat dan minuman cokelat dengan konsep yang menarik.,Food & Beverage,Waralaba,2892720000.0,0812 2797 7860,vitofebri.fk@gmail.com,2019.0,Vanbury.,,,,,,,,144,0,0,0,0,0,0,0,1,0,0,0,0,0,0,0,0,0,0,0,0,0
203,https://klikfranchise.com/services/franchisedankemitraan/detail/4n2x6bgl8blovgvawx0jkpry2lrojp7eqd4mz15ye9kaqdmnwa,Steak On The Street Cafe,Restoran yang menyajikan hidangan steak dengan konsep yang santai.,Food & Beverage,Waralaba,3667000.0,0821 1431 2826,steakonthestreet1@gmail.com,2018.0,CV. Saudagar Langit.,,,,,,,,617,0,0,0,0,0,0,0,1,0,0,0,0,0,0,0,0,0,0,0,0,0
204,https://klikfranchise.com/services/franchisedankemitraan/detail/4vjd1bwjpwrl7ka03ypxnqyzgear6zoo5lb2dgmx4gk8enve9d,SMES JUICE,Warung minuman yang menawarkan berbagai jenis jus segar.,Food & Beverage,Waralaba,55000000.0,0815 6023 535,santos_edo@yahoo.com,,,,,,,,,,962,0,0,0,0,0,0,0,1,0,0,0,0,0,0,0,0,0,0,0,0,0
205,https://klikfranchise.com/services/franchisedankemitraan/detail/4x9eddg5nvzvylya2qm4mpnavdqjxw0wzbrek8bp731kjglo6w,YOOMA BOBA,Franchise minuman boba yang menawarkan berbagai varian minuman boba yang lezat dan inovatif.,Food & Beverage,Waralaba,30000000.0,0821 2430 7575,abragroup.id@gmail.com,2021.0,CV ABRA GROUP INDONESIA.,,,,,,,,245,0,0,0,0,0,0,0,1,0,0,0,0,0,0,0,0,0,0,0,0,0
206,https://klikfranchise.com/services/franchisedankemitraan/detail/57dr0plx6zmqee5zlvkbxjnnzygrg39apokow1bmajd2y4yq8x,Sultan Pisang Goreng,Warung makan yang terkenal dengan pisang goreng khas Sultan dengan cita rasa yang lezat.,Food & Beverage,Waralaba,1899000.0,0818 0259 9000,,,,,,,,,,,957,0,0,0,0,0,0,0,1,0,0,0,0,0,0,0,0,0,0,0,0,0
207,https://klikfranchise.com/services/franchisedankemitraan/detail/5azmkdgbqkn8vpz3qore9p6w9n2vjow71nrdyj0xgmlxbyle5g,Yokobana Fried Chicken,"Fried chicken dengan cita rasa khas Yokobana, mungkin dengan bumbu atau resep yang memberikan sentuhan Jepang pada hidangan.",Food & Beverage,Waralaba,75000000.0,0813 1906 4030,,,,,,,,,,,277,0,0,0,0,0,0,0,1,0,0,0,0,0,0,0,0,0,0,0,0,0
208,https://klikfranchise.com/services/franchisedankemitraan/detail/5dp2vw5xa4vez1jrr8l7nag0oamyxz9kyqbkpngoj6deolqbmj,Suga Boba Indonesia,Franchise minuman boba yang menawarkan berbagai varian minuman boba dengan cita rasa yang unik.,Food & Beverage,Waralaba,35000000.0,085 735 300 400,sugaboba.id@gmail.com,2020.0,CV. Startup International.,,,,,,,,244,0,0,0,0,0,0,0,1,0,0,0,0,0,0,0,0,0,0,0,0,0
209,https://klikfranchise.com/services/franchisedankemitraan/detail/5eojon0ra714rmkdjz3q26lbnkwkvwydvxbnpgmqlg98aepy5o,Sobat Haus,Warung makan dengan konsep yang ramah dan menyajikan hidangan yang lezat.,Food & Beverage,Waralaba,14900000.0,0821 3419 8296,sobathaus.official@gmail.com,2019.0,CV.Saudagar Langit.,,,,,,,,911,0,0,0,0,0,0,0,1,0,0,0,0,0,0,0,0,0,0,0,0,0
210,https://klikfranchise.com/services/franchisedankemitraan/detail/64epqd6j2rr0eyyzaxpwkomzr85nnla1w9vojd7kg8m3vlbxqd,The Parfum Bar,Toko yang menawarkan berbagai jenis parfum.,Health & Beauty,Waralaba,5000000.0,0858 6794 2389,pineleaf.indo@1gmail.com,2018.0,CV. Pineleaf Indonesia.,,,,,,,,812,0,0,0,0,0,0,0,0,0,0,0,0,0,0,0,0,0,0,0,1,0
211,https://klikfranchise.com/services/franchisedankemitraan/detail/64yq2wj63er0zpxygqewkanbqqb9av1bdomng57lvomxdrzl8g,Tentang Dia,Nama yang mungkin terkait dengan tempat makan atau kafe dengan tema tentang seseorang.,Food & Beverage,Waralaba,3700000.0,0822 9834 4457,tentangdiaindonesia@outlook.com,2020.0,,,,,,,,,550,0,0,0,0,0,0,0,1,0,0,0,0,0,0,0,0,0,0,0,0,0
212,https://klikfranchise.com/services/franchisedankemitraan/detail/65mewb6oqlm13xjgrvpn8v2x4apyzyazewo9dajl07rk4nkbqr,Senada Cokelat,Warung makan yang menawarkan berbagai hidangan dengan menggunakan cokelat sebagai bahan utama.,Food & Beverage,Waralaba,2379000.0,0812 1368 8482,senadacokelat@gmail.com,2019.0,Wonderkid Group.,,,,,,,,913,0,0,0,0,0,0,0,1,0,0,0,0,0,0,0,0,0,0,0,0,0
213,https://klikfranchise.com/services/franchisedankemitraan/detail/6al5e879qbgepo3b4kwg0dva4gvnkjrz6qwynzrjpomdmx2xyk,Time Zone,Pusat hiburan atau tempat bermain yang menawarkan permainan arkade dan lainnya.,Hobby & Entertainment,Waralaba,1200000.0,021 4682 6505,,,PT Matahari Graha Fantasi.,,,,,,,,590,0,0,0,0,0,0,0,0,0,1,0,0,0,0,0,0,0,0,0,0,0
214,https://klikfranchise.com/services/franchisedankemitraan/detail/6gdl7xqnypqkjvdn8ma2pevx4mzjbrze5ay9g4rwbw1kom60l0,Waroeng Oversize,"Warung makan yang menawarkan hidangan dengan porsi besar atau ""oversize,"" memberikan nilai tambah untuk pelanggan.",Food & Beverage,Waralaba,150000000.0,0852 3155 7856,oversize.semarang@gmail.com,2016.0,,,,,,,,,926,0,0,0,0,0,0,0,1,0,0,0,0,0,0,0,0,0,0,0,0,0
215,https://klikfranchise.com/services/franchisedankemitraan/detail/6kqrbjx3vmwdazo5ygo0wk8prdvrbqpm4yxnldl76eg29e1njo,Si.Nasi,Warung makan yang menawarkan berbagai hidangan nasi.,Food & Beverage,Waralaba,35000000.0,0812 1937 6661,,,Kawan Kuliner Group.,,,,,,,,915,0,0,0,0,0,0,0,1,0,0,0,0,0,0,0,0,0,0,0,0,0
216,https://klikfranchise.com/services/franchisedankemitraan/detail/6obx7zynlv6wrog9m24bv5qqjp3pk8ypjddnze0jaga1wmrkld,Umbo Stick,"Bisnis yang menawarkan produk atau layanan dengan konsep stick atau batang, mungkin dalam berbagai variasi.",Food & Beverage,Kemitraan,6000000.0,031 5923 386,,,CV Paramuda agro Nusantara.,,,,,,,,143,0,0,0,0,0,0,0,1,0,0,0,0,0,0,0,0,0,0,0,0,0
217,https://klikfranchise.com/services/franchisedankemitraan/detail/6qn7m8dplevjn9jwpmoqdr25wdzxkay60rlyawg1kg4zbeob3g,Wani Klimis Barbershop,"Barbershop yang menonjolkan konsep yang berani dan klimis, menawarkan layanan potong rambut dan perawatan lainnya.",Health & Beauty,Waralaba,75000000.0,0856 4066 3600,,2014.0,CV Pram Glory.,,,,,,,,92,0,0,0,0,0,0,0,0,0,0,0,0,0,0,0,0,0,0,0,1,0
218,https://klikfranchise.com/services/franchisedankemitraan/detail/6yv9jxm536ek87mdzoaqoj1anogenwgrp04vbqbxlz2dwplrkl,SOSIS NDOWER INDONESIA,Warung makan yang menawarkan berbagai varian sosis dengan citarasa khas Indonesia.,Food & Beverage,Waralaba,4000000.0,0819 3644 7740,Marketingsosisndower@gmail.com,2019.0,PENTOL NDOWER GROUP.,,,,,,,,923,0,0,0,0,0,0,0,1,0,0,0,0,0,0,0,0,0,0,0,0,0
219,https://klikfranchise.com/services/franchisedankemitraan/detail/71agxrlenao0wv3n62xjdjybjkvqrm8mqkwbkg74ezzp5pd9ln,Tahu Bule,Warung makan yang menawarkan tahu dengan berbagai varian dan citarasa khas Indonesia.,Food & Beverage,Waralaba,5000000.0,022 9193 0550,,,CV HWK Media Utama.,,,,,,,,944,0,0,0,0,0,0,0,1,0,0,0,0,0,0,0,0,0,0,0,0,0
220,https://klikfranchise.com/services/franchisedankemitraan/detail/7bzz1lvlr2rqyp0ojae56jbwqxmk8xmwao9epyn3dgkdqn4x7y,The Lieza Skin Care,Tempat yang menawarkan layanan perawatan kulit atau produk perawatan kulit.,Health & Beauty,Waralaba,80000000.0,021 4288 5155,,,PT. Ilham Malindo.,,,,,,,,747,0,0,0,0,0,0,0,0,0,0,0,0,0,0,0,0,0,0,0,1,0
221,https://klikfranchise.com/services/franchisedankemitraan/detail/7nojexvqglwe7rpyldmkamdbwv9q6r15kbyv2g0on4zj8apz3a,Teh Cap Poci,Tempat yang menyajikan teh dengan gaya tradisional menggunakan cap poci.,Food & Beverage,Waralaba,5000000.0,021 2263 1372,info@gunungslamat.com,1950.0,,,,,,,,,792,0,0,0,0,0,0,0,1,0,0,0,0,0,0,0,0,0,0,0,0,0
222,https://klikfranchise.com/services/franchisedankemitraan/detail/8apm4mlq708zwkvv5eoy9exbjwzplyragd623n1xbjnkrwgjdw,Tentang Kita Toast,Tempat makan atau kafe dengan tema tentang kisah atau cerita.,Food & Beverage,Waralaba,3799000.0,0878 3900 9480,mommilkexpress@gmail.com,2020.0,,,,,,,,,711,0,0,0,0,0,0,0,1,0,0,0,0,0,0,0,0,0,0,0,0,0
223,https://klikfranchise.com/services/franchisedankemitraan/detail/8da7qjbw3mkdz8lpoyo4pxe5br5gln1vmr6q2gnr0ajybkexw1,Vecto Solution,Perusahaan yang menyediakan solusi teknologi atau IT dengan fokus pada pengembangan perangkat lunak.,Technology,Kemitraan,43000000.0,0812 7712 367,vectosolution@yahoo.com,2009.0,PT. VECTOKIL.,,,,,,,,580,0,0,0,0,0,0,0,0,0,0,0,0,0,0,0,0,0,0,0,0,1
224,https://klikfranchise.com/services/franchisedankemitraan/detail/8jp8mvrxlmz0avqeyzrod53lrgabkxgo4w1dk6webn9jpg27nv,Texas Chicken,Rantai restoran yang terkenal dengan ayam goreng.,Food & Beverage,Waralaba,1290870000.0,,,1952.0,PT.Cipta Selera Murni.,,,,,,,,597,0,0,0,0,0,0,0,1,0,0,0,0,0,0,0,0,0,0,0,0,0
225,https://klikfranchise.com/services/franchisedankemitraan/detail/8n8gjyrboepxlz60e3m7w5aqnejwamxb9vkzvqdpo4lyk1rg21,Taruna Nusantara Motor,Bisnis atau dealer sepeda motor dengan nama yang mencerminkan identitas nasional.,Automotive,Waralaba,50000000.0,0281 621 505,,,Dian Automach.,,,,,,,,124,0,0,0,0,1,0,0,0,0,0,0,0,0,0,0,0,0,0,0,0,0
226,https://klikfranchise.com/services/franchisedankemitraan/detail/8rb9yweg423bjzvk5m1mkdor5ngyaxljn8zwoaq6qv7pne0dlb,Susu Ninja,Warung makan yang menawarkan berbagai jenis minuman susu.,Food & Beverage,Waralaba,2000000.0,0816 4680 8380,,2021.0,,,,,,,,,918,0,0,0,0,0,0,0,1,0,0,0,0,0,0,0,0,0,0,0,0,0
227,https://klikfranchise.com/services/franchisedankemitraan/detail/8w3o0dpq82xvbl9kbrn7yerqv2qz4gemaw6ok1dvpyxjazg5lo,Taman Sari Royal Heritage Spa,Spa yang menawarkan layanan kecantikan dengan sentuhan budaya atau warisan.,Health & Beauty,Waralaba,150000000.0,021 314 3585 / 380 1433,spa@mustikaratu.co.id,1996.0,Group Mustika Ratu.,,,,,,,,664,0,0,0,0,0,0,0,0,0,0,0,0,0,0,0,0,0,0,0,1,0
228,https://klikfranchise.com/services/franchisedankemitraan/detail/8wjgzg86mydowlbr2pl9xedjrzjyk30oe7qaknavnq1b4prv5z,Top Voucher Hotel,Platform atau bisnis yang menawarkan voucher hotel dengan penawaran khusus.,Logistics,Waralaba,7500000.0,031 8662 785,,2006.0,,,,,,,,,588,0,0,0,0,0,0,0,0,0,0,1,0,0,0,0,0,0,0,0,0,0
229,https://klikfranchise.com/services/franchisedankemitraan/detail/937zxybkga4nlw2dmran1odv2p5xqbp9revkw8q0zlyomjjg6z,Street Sushi,Warung makan yang menawarkan berbagai jenis sushi dengan konsep yang khas jalanan.,Food & Beverage,Waralaba,,0821 2595 1133,info@stretsushiindonesia.com,2013.0,,,,,,,,,921,0,0,0,0,0,0,0,1,0,0,0,0,0,0,0,0,0,0,0,0,0
230,https://klikfranchise.com/services/franchisedankemitraan/detail/99ovwpdmbxal1ndwyepgm420edk6zq7jnr5jz3egkrxalyoqb5,Topcoat,Bisnis atau layanan yang berkaitan dengan lapisan atau pelapisan (seperti pelapisan cat mobil).,Automotive,Kemitraan,250000000.0,021 2943 8375,info@topcoating.com,2018.0,MAKKO Group.,,,,,,,,125,0,0,0,0,1,0,0,0,0,0,0,0,0,0,0,0,0,0,0,0,0
231,https://klikfranchise.com/services/franchisedankemitraan/detail/9exjqxrbz56qw1nkylolm3anz9rg7pb4y0odmgzw9jekdvp82l,Yago Chicken,"Fried chicken dengan cita rasa unik dan bumbu yang khas Yago, mungkin dengan pengaruh dan inspirasi dari berbagai daerah.",Food & Beverage,Waralaba,1000000.0,021 2126 0001,,2019.0,CV. Berkah Anuegrah Sentosa.,,,,,,,,278,0,0,0,0,0,0,0,1,0,0,0,0,0,0,0,0,0,0,0,0,0
232,https://klikfranchise.com/services/franchisedankemitraan/detail/9jer9zapvgjobve7y4lbxky8p3lm51dkw36orxn2qaq0wndgzq,Shake A Shake,Warung minuman yang menawarkan berbagai jenis minuman dengan metode pengocokan khas.,Food & Beverage,Waralaba,140000000.0,0888 9222 355,,2020.0,PT. Sumber Kuliner Cipta Kreasindo.,,,,,,,,963,0,0,0,0,0,0,0,1,0,0,0,0,0,0,0,0,0,0,0,0,0
233,https://klikfranchise.com/services/franchisedankemitraan/detail/9pkvbn9pr74wjlma6m8dkdeba7znyo25yej0gaxxqwlg3o1vra,Teh Sofia,Tempat yang menawarkan teh dengan tema Sofia atau suasana yang elegan.,Food & Beverage,Waralaba,5000000.0,031 8792 341,,,Tofuku Mitra Indonesia.,,,,,,,,751,0,0,0,0,0,0,0,1,0,0,0,0,0,0,0,0,0,0,0,0,0
234,https://klikfranchise.com/services/franchisedankemitraan/detail/9rpdzb9pr56kwydngvqgzmm0npknyevjewx2lajoao7483qb1m,Ultra Disc,Bisnis yang menawarkan berbagai produk atau layanan berbasis digital atau disc (diskon).,Hobby & Entertainment,Kemitraan,60000000.0,021 3443 223,,2001.0,PT. Ultra Disc.,,,,,,,,139,0,0,0,0,0,0,0,0,0,1,0,0,0,0,0,0,0,0,0,0,0
235,https://klikfranchise.com/services/franchisedankemitraan/detail/9vw9n3ry58jzjl0lnqkd1xdqngb7av4moawpozbmkxye2peg63,Waffelicious,Warung yang menawarkan variasi waffle dengan berbagai pilihan rasa dan topping.,Food & Beverage,Waralaba,45000000.0,0812 2581 1888,hendytanaka@gmail.com,2011.0,Waffelicious.,,,,,,,,970,0,0,0,0,0,0,0,1,0,0,0,0,0,0,0,0,0,0,0,0,0
